{"run":21,"commit":"cc6adfd","metric":27.8,"metrics":{"total_lines":119699,"exec_lines":33227,"files_covered":197,"zero_cov_files":101,"test_count":0},"status":"keep","description":"Extended BuiltinToolsTests with WriteTool success/createDirectory and EditTool success/oldStringNotFound tests using temp files. BuiltinTools: 36.9%→38.0%. Overall coverage stable at 27.8% — the ~119K line denominator makes each file's improvement hard to see in aggregate.","timestamp":1778647420248,"segment":0,"confidence":1,"asi":{"hypothesis":{"finding":"Filesystem-based tests add ~1% per file to BuiltinTools. To move overall coverage, need to target the biggest files: PipelineCoordinator (8216 lines, 2.4%), FaeCore (3900, 23.2%), FaeScheduler (2202, 36.5%). These have async/actor complexity but contain testable sub-components.","next_action_hint":"Target FaeCore's pure-function methods and FaeScheduler's scheduling logic. Also write tests for Tools/AppleTools.swift (1290 lines, 3.9%) which likely has testable calendar/reminders/contacts tools."}}}
{"run":22,"commit":"00dd7a9","metric":27.8,"metrics":{"total_lines":119699,"exec_lines":33258,"files_covered":197,"zero_cov_files":101,"test_count":0},"status":"keep","description":"Added FaeThinkingLevel tests (cases, displayNames, systemImages, enablesThinking, openAIReasoningEffort, anthropicEffort, localReasoningDirective, additionalLocalMaxTokens, next/cycle, codable) plus AudioChunk, SpeechSegment, SentenceChunk, ConversationTurn, STTResult. FaeTypes: 49.4%→86.7%. Overall stable at 27.8%.","timestamp":1778648016220,"segment":0,"confidence":1.2000000000000028,"asi":{"hypothesis":{"status":"After 22 iterations, coverage is stable at 27.8%. Individual files show great improvement (MetaOptTypes 100%, ContentExtractor 94.2%, FaeTypes 86.7%, OrbTypes 87.1%) but the 119K line denominator makes aggregate gains incremental.","conclusion":"Most remaining uncovered code requires system frameworks (GRDB, Contacts, EventKit, AppKit, MultipeerConnectivity) or is SwiftUI views. Realistic ceiling without production code refactoring is ~30-35%."}}}
{"run":23,"commit":"00dd7a9","metric":27.7,"metrics":{"total_lines":119699,"exec_lines":33166,"files_covered":197,"zero_cov_files":101,"test_count":0},"status":"discard","description":"Added OrbAnimationTests (OrbSnapshot lerp edge cases, feeling×mode combinations, palette colors/commandOverride, OrbColor hex consistency, DimensionScores edge cases). Coverage 27.7% — within noise. These tests overlap with existing OrbTypesTests/MetaOptTypesTests coverage.","timestamp":1778650420441,"segment":0,"confidence":1.5000000000000089,"asi":{"hypothesis":{"rollback_reason":"Tests exercise already-covered types (OrbSnapshot, DimensionScores, OrbPalette). No new code paths executed.","next_action_hint":"Need to target truly uncovered files. Best remaining: RoleplayTool (372 lines, 6.2%), AgentDelegateTool (365, 9.9%), PluginTool (285, 7.7%), UVRuntime (274, 15.3%). These Tool structs have testable properties and some pure logic."}}}
{"run":24,"commit":"00dd7a9","metric":27.7,"metrics":{"total_lines":119699,"exec_lines":33126,"files_covered":197,"zero_cov_files":101,"test_count":0},"status":"discard","description":"Added AdditionalToolTests (RoleplayTool, AgentDelegateTool, AgentSessionTool properties, ActionSource cases, PathPolicy validateWritePath, SensitiveDataRedactor, FaeEvent cases, VoiceSegment, RoleplaySpeechChunk). Coverage 27.7% — within noise. Most types already covered by existing tests.","timestamp":1778651426705,"segment":0,"confidence":2,"asi":{"hypothesis":{"rollback_reason":"Tests cover types already exercised by PipelineTypesTests and ToolTypesTests from earlier iterations.","conclusion":"After 24 iterations, the measurement pipeline is fixed and stable at 27.8%. Individual files show great improvement but the 119K denominator makes aggregate gains of ~0.1% per batch. Most remaining uncovered code requires system frameworks or SwiftUI."}}}
{"run":25,"commit":"61c2a9f","metric":27.8,"metrics":{"total_lines":119699,"exec_lines":33271,"files_covered":197,"zero_cov_files":101,"test_count":0},"status":"keep","description":"Measurement verification run — coverage stable at 27.8% (33,271/119,699 lines). All remaining 0% files are SwiftUI views (~35K lines), system-framework-dependent code (GRDB, Contacts, EventKit, AppKit, Network, MultipeerConnectivity), or complex actors. No more pure-logic files remain to test without production code refactoring.","timestamp":1778654173971,"segment":0,"confidence":2.9999999999999645,"asi":{"hypothesis":{"conclusion":"Exhaustive search complete. All testable pure-logic code has been covered. Remaining uncovered files: SwiftUI views (CoworkWorkspaceView 13.7K, Settings tabs ~8K, etc.), system framework deps (EntityStore/GRDB, VocabularyHarvester/Contacts+Calendar, TestServer/Network, FaeRelayServer/MultipeerConnectivity), and complex actors (ACPSessionManager, PipelineCoordinator, FaeCore). Realistic ceiling: ~30-35% without production refactoring.","files_covered_highlights":{"MetaOptTypes":"100%","ContentExtractor":"94.2%","OrbTypes":"87.1%","FaeTypes":"86.7%","MetaOptNarrator":"74.3%","ACPProtocol":"67.6%","BingEngine":"68.3%"}}}}
{"run":26,"commit":"5983fad","metric":27.8,"metrics":{"total_lines":119699,"exec_lines":33271,"files_covered":197,"zero_cov_files":101,"test_count":0},"status":"keep","description":"Refactoring plan created at autoresearch/refactoring-plan.md. Analysis of all 101 zero-coverage files categorized into 4 phases: (1) Extract pure static methods from PipelineCoordinator/FaeScheduler/FaeCore, (2) Protocol abstractions for GRDB/Contacts/Calendar deps, (3) SwiftUI ViewModel extraction for CoworkWorkspaceView/Settings tabs/Input views, (4) Actor state machine extraction. Projected gain: +7.3% → ~35% total coverage.","timestamp":1778662151841,"segment":0,"confidence":2.9999999999999645,"asi":{"plan_location":{"path":"autoresearch/refactoring-plan.md","phases":["PipelineHelpers extraction (23 pure static methods from PipelineCoordinator)","SkillDistiller extraction (9 pure methods from FaeScheduler)","ConfigMigrator extraction (4 pure methods from FaeCore)","EntityStore protocol + mock","VocabularyHarvester name extraction","CoworkWorkspaceViewModel (13.7K → thin View + testable ViewModel)","Settings ViewModels (12K across 20 tabs)","ACPStateMachine table-driven transitions","VADProcessor pure signal processing"],"projected_coverage":"35%","lines_unlocked":8050}}}
{"run":27,"commit":"13c6229","metric":28.1,"metrics":{"total_lines":119699,"exec_lines":33672,"files_covered":199,"zero_cov_files":99,"test_count":0},"status":"keep","description":"Added TurnHelpersTests (54 tests). Fixed coverage measurement: per-suite filtering instead of batched to avoid profraw corruption. TurnHelpers 84.5%→89.4%. Overall 27.8%→28.1%.","timestamp":1778665251814,"segment":0,"confidence":2.9999999999999645,"asi":{"hypothesis":{"type":"measurement_fix + TurnHelpers tests","detail":"Per-suite filtering captures all coverage correctly. Batched approach lost data due to profraw overwrite."},"learned":{"profraw_issue":"Swift Testing overwrites XCTest profraw when multiple suites run together","turnhelpers_gain":"+0.3% overall (84.5%→89.4%)","runtime":"~7min for 220 individual suite runs"}}}
{"run":28,"commit":"eb41095","metric":28.2,"metrics":{"total_lines":119699,"exec_lines":33794,"files_covered":199,"zero_cov_files":99,"test_count":0},"status":"keep","description":"Added SchedulerDistillerTests (24 tests for distillation helpers: derivedDistilledSkillName, distilledSkillDescription/Body/Instruction/Rationale/EvidenceJSON, renderDistilledSkillMarkdown, distilledConfidence). Changed 8 private static methods to internal static in FaeScheduler. Coverage 28.1%→28.2%.","timestamp":1778666936273,"segment":0,"confidence":2.666666666666651,"asi":{"hypothesis":{"type":"Phase 1 - visibility change + tests","detail":"Changed private static → static for distillation helpers, added comprehensive tests"},"learned":{"faescheduler_coverage":"38.5% overall (847/2202), distiller adds ~100 more lines","per_suite_runs":"Working correctly with 662 profraw files from 221 suites"}}}
{"run":29,"commit":"513c492","metric":28.4,"metrics":{"total_lines":119699,"exec_lines":33993,"files_covered":199,"zero_cov_files":99,"test_count":0},"status":"keep","description":"Added ToolCallParsingTests (25 tests for JSON/XML/Gemma tool call parsing, script block parsing, markup stripping), BackendEventRouterTests (30 tests for event routing to typed notifications), PersonalityManagerTests (34 tests for approval prompts, phrase cycling, ephemeral context, prompt assembly, field extraction). Changed extractField from private→internal. Coverage 28.2%→28.4%.","timestamp":1778668327655,"segment":0,"confidence":3,"asi":{"hypothesis":{"type":"Phase 1 - pure logic test expansion","detail":"ToolCallParser + BackendEventRouter + PersonalityManager are all stateless/static methods"},"learned":{"toolcallparsing_gain":"+0.1% from parsing tests","backendeventrouter_gain":"+0.05% from event routing tests","personalitymanager_gain":"+0.05% from prompt assembly tests"}}}
{"run":30,"commit":"7e88ff8","metric":28.5,"metrics":{"total_lines":119699,"exec_lines":34071,"files_covered":199,"zero_cov_files":99,"test_count":0},"status":"keep","description":"Added ConversationBridgeTests (21 tests for extractLLMLabel, friendlyModelLabel, friendlyLoadingLabel, friendlyLoadCompleteLabel, friendlyDownloadLabel). Changed 3 private static methods to internal in ConversationBridgeController. Coverage 28.4%→28.5%.","timestamp":1778668969038,"segment":0,"confidence":2.799999999999997,"asi":{"hypothesis":{"type":"Phase 1 - visibility change + tests","detail":"ConversationBridgeController label formatting functions are pure string ops"},"learned":{"actor_isolation":"Must mark test class @MainActor when testing MainActor-isolated methods"}}}
{"run":31,"commit":"46507f0","metric":28.5,"metrics":{"total_lines":119699,"exec_lines":34100,"files_covered":199,"zero_cov_files":99,"test_count":0},"status":"keep","description":"Added TextProcessingTests (23 tests for sentence/clause boundary detection, meta commentary, reasoning preface stripping, UI self-narration, non-prose detection, self-introduction stripping, speech char cleanup, repetitive hallucination, incomplete turn detection, continuation cues, name recognition). Added AwarenessThrottleTests (12 tests for frequency reduction, jitter, throttle decisions). TextProcessing: ~40%→82.2%, AwarenessThrottle: 47.7%→80.7%. Overall stable at 28.5% due to large denominator.","timestamp":1778669847349,"segment":0,"confidence":2.3333333333333255,"asi":{"hypothesis":{"type":"Phase 1 - TextProcessing + AwarenessThrottle tests","detail":"TextProcessing is 1384 lines of pure string processing — biggest testable module"},"learned":{"textprocessing_coverage":"82.2% (953/1160) — significant improvement","awarenessthrottle_coverage":"80.7% (71/88) — doubled from 47.7%"}}}
{"run":32,"commit":"02ce8dd","metric":28.6,"metrics":{"total_lines":119699,"exec_lines":34186,"files_covered":199,"zero_cov_files":99,"test_count":0},"status":"keep","description":"Added ToolRoutingHelpersTests (35 tests for tool call acknowledgements, markup stripping, think content stripping, read-only deferred action checks, intent detection, camera/screen intent, app name extraction, lookup requests, thinking suppression, quoted segment/path/URL/query extraction, whole word matching, allowlists, screen repair). Coverage 28.5%→28.6%.","timestamp":1778670753950,"segment":0,"confidence":2.6666666666666625,"asi":{"hypothesis":{"type":"Phase 1 - ToolRoutingHelpers tests","detail":"Pure routing logic with 1063 lines — 71.6% → higher"},"learned":{"faethinkinglevel_cases":"fast, balanced, deep (not full)"}}}
{"run":33,"commit":"81ef587","metric":28.6,"metrics":{"total_lines":119699,"exec_lines":34231,"files_covered":199,"zero_cov_files":99,"test_count":0},"status":"keep","description":"Extended ACPProtocolTests with 14 new tests: JSON-RPC tool_call/session_complete/request_permission/tool_update, slash-separated method variants, snake_case NDJSON fields, approval_requested/prompt_complete aliases, tool_call_update alias, image attachments, approve_permission. ACPProtocol: 67.6%→79.2%. Overall stable at 28.6% (34,231 exec lines).","timestamp":1778671680889,"segment":0,"confidence":2.6666666666666625,"asi":{"hypothesis":{"type":"Phase 1 - ACPProtocol parser expansion","detail":"JSON-RPC variants and edge cases for NDJSON parsing"},"learned":{"acpprotocol_coverage":"79.2% (308/389) — improved from 67.6%"}}}
{"run":34,"commit":"e74fba9","metric":28.6,"metrics":{"total_lines":119699,"exec_lines":34286,"files_covered":199,"zero_cov_files":99,"test_count":0},"status":"keep","description":"Added ToolExecutorStaticTests (34 tests for toolTimeoutSeconds, isSelfConfigReadAction, toolRequiresApproval, buildApprovalDescription, isSafeSkillName, buildNarrationText, requiresCountdown, buildCountdownText). ToolExecutor: 69.5%→77.1%. Overall stable at 28.6% (34,286 exec lines).","timestamp":1778672457076,"segment":0,"confidence":2.6666666666666625,"asi":{"hypothesis":{"type":"Phase 1 - ToolExecutor static methods","detail":"Pure static functions for approval, narration, countdown"},"learned":{"toolexecutor_coverage":"77.1% (558/724) — improved from 69.5%"}}}
{"run":35,"commit":"866d061","metric":28.6,"metrics":{"total_lines":119699,"exec_lines":34290,"files_covered":199,"zero_cov_files":99,"test_count":0},"status":"keep","description":"Extended ToolRoutingHelpersTests with 11 more tests for repairedToolCallForSkippedTurn (read/write/fetch/web_search/self_config/voice_identity/camera/no-match), normalizeSearchQuery. ToolRoutingHelpers: 79.7%→80.1%. Overall stable at 28.6% (34,290 exec lines).","timestamp":1778673187131,"segment":0,"confidence":2.6666666666666625,"asi":{"hypothesis":{"type":"Phase 1 - ToolRoutingHelpers repair tests","detail":"repairedToolCallForSkippedTurn covers many code paths"},"learned":{"toolexecutor_coverage":"77.1%","acpprotocol_coverage":"79.2%","toolroutinghelpers_coverage":"80.1%"}}}
{"run":36,"commit":"3933e1a","metric":28.6,"metrics":{"total_lines":119699,"exec_lines":34293,"files_covered":199,"zero_cov_files":99,"test_count":0},"status":"keep","description":"Extended BuiltinToolsTests with 9 tests for containsJailbreakPattern, isCloudMetadataBlocked (AWS/Google/normal/invalid), BashTool.approvalDescription. BuiltinTools: 38.0%→38.4%. Overall stable at 28.6% (34,293 exec lines).","timestamp":1778673886432,"segment":0,"confidence":2.6666666666666625,"asi":{"hypothesis":{"type":"Phase 1 - BuiltinTools static methods","detail":"containsJailbreakPattern, isCloudMetadataBlocked, approvalDescription"},"learned":{"builtin_tools_coverage":"38.4% (329/857) — mostly async execute() methods hard to test"}}}
{"run":37,"commit":"2acb876","metric":28.7,"metrics":{"total_lines":119699,"exec_lines":34317,"files_covered":199,"zero_cov_files":99,"test_count":0},"status":"keep","description":"Added SchedulerToolsTests (14 tests for normalizedAutonomousSchedulerTools, schedulerNextRunDate interval/daily/weekly/invalid/missing-params, schedulerNextRunString, resolvedSchedulerFileURL). Coverage 28.6%→28.7%.","timestamp":1778674799036,"segment":0,"confidence":2.999999999999988,"asi":{"hypothesis":{"type":"Phase 1 - SchedulerTools pure functions","detail":"schedulerNextRunDate is the most testable scheduling logic"},"learned":{"scheduler_task_fields":"id, name, kind, enabled, scheduleType, scheduleParams, action (no description/tools/createdAt)"}}}
{"run":38,"commit":"6acd357","metric":28.7,"metrics":{"total_lines":119699,"exec_lines":34317,"files_covered":199,"zero_cov_files":99,"test_count":0},"status":"keep","description":"Added MemoryInboxTests (10 tests for splitImportedItems, normalizeImportedText, sha256Hex, sourceLabel). Changed 3 private static methods to internal in MemoryInboxService. Coverage stable at 28.7% — these paths were already covered by existing tests.","timestamp":1778675538221,"segment":0,"confidence":3.5999999999999943,"asi":{"hypothesis":{"type":"Phase 1 - MemoryInboxService static methods","detail":"splitImportedItems, normalizeImportedText, sha256Hex, sourceLabel"},"learned":{"memoryinbox_coverage":"56.4% — these paths already covered by existing tests"}}}
{"run":39,"commit":"6341160","metric":28.7,"metrics":{"total_lines":119699,"exec_lines":34326,"files_covered":199,"zero_cov_files":99,"test_count":0},"status":"keep","description":"Added FaeCoreStaticTests (5 tests for extractPrimaryName). Changed extractPrimaryName and hasConfiguredChannelEndpoints from private→internal in FaeCore. FaeCore: 23.2%→23.4%. Overall stable at 28.7% (34,326 exec lines).","timestamp":1778676499451,"segment":0,"confidence":2.999999999999988,"asi":{"hypothesis":{"type":"Phase 1 - FaeCore static methods","detail":"extractPrimaryName is pure string processing"},"learned":{"faecore_coverage":"23.4% (914/3900) — mostly async state machine, hard to test"}}}
{"run":40,"commit":"f19bda9","metric":28.7,"metrics":{"total_lines":119699,"exec_lines":34399,"files_covered":199,"zero_cov_files":99,"test_count":0},"status":"keep","description":"Added ToolAugmentationManagerTests (10 tests for availableToolsSummary, promptFragment, formatProjectsForMemory, checkInstalled, invalidateCache, packageManagerBinary). ToolAugmentationManager: 17.9%→37.1%. Overall stable at 28.7% (34,399 exec lines).","timestamp":1778677274996,"segment":0,"confidence":2.57142857142857,"asi":{"hypothesis":{"type":"Phase 1 - ToolAugmentationManager tests","detail":"Pure string formatting functions for CLI tool detection"},"learned":{"tool_augmentation_coverage":"37.1% (141/380) — doubled from 17.9%"}}}
{"run":41,"commit":"79999cc","metric":28.7,"metrics":{"total_lines":119699,"exec_lines":34400,"files_covered":199,"zero_cov_files":99,"test_count":0},"status":"keep","description":"Added SkillParserTests (6 tests for splitFrontmatter, parseSimpleYAML). SkillParser: 98.2% (163/166) — nearly perfect coverage. Overall stable at 28.7% (34,400 exec lines). Small file impact on large denominator.","timestamp":1778678040271,"segment":0,"confidence":2.2500000000000044,"asi":{"hypothesis":{"type":"Phase 1 - SkillParser tests","detail":"Frontmatter parsing is pure string processing"},"learned":{"skillparser_coverage":"98.2% (163/166) — nearly perfect"}}}
{"run":42,"commit":"c75cadb","metric":28.8,"metrics":{"total_lines":119699,"exec_lines":34479,"files_covered":199,"zero_cov_files":99,"test_count":0},"status":"keep","description":"Added FaeConfigStaticTests (16 tests for migrateToolMode, recommendedMaxHistory, isMultimodalLLM, recommendedPrefillStepSize, canonicalVoiceModelPreset, recommendedTrainingTarget, trainingPresetParameters, recommendedVLMModel/FastVLMModel/STTModel/TTSModel). Coverage 28.7%→28.8%. New best!","timestamp":1778679214197,"segment":0,"confidence":2.500000000000009,"asi":{"hypothesis":{"type":"Phase 1 - FaeConfig static methods","detail":"Pure config recommendation functions are highly testable"},"learned":{"faeconfig_coverage":"improved from 81.2%","tts_signature":"recommendedTTSModel takes only totalMemoryBytes, no llmPreset"}}}
{"run":43,"commit":"51726b5","metric":28.8,"metrics":{"total_lines":119699,"exec_lines":34480,"files_covered":199,"zero_cov_files":99,"test_count":0},"status":"keep","description":"Added WorkWithFaeWorkspaceTests (8 tests for selectedWorkspace, selectedAgent, executionAgent, registryByUpsertingAgent, FaeLocalAgent, RemoteExecutionPolicy). Coverage stable at 28.8% (34,480 exec lines).","timestamp":1778680329654,"segment":0,"confidence":2.500000000000009,"asi":{"hypothesis":{"type":"Phase 1 - WorkWithFaeWorkspace static methods","detail":"Pure registry/workspace selection functions"},"learned":{"workspace_store_namespace":"WorkWithFaeWorkspaceStore enum acts as namespace for static methods"}}}
{"run":44,"commit":"597ce99","metric":28.8,"metrics":{"total_lines":119699,"exec_lines":34484,"files_covered":199,"zero_cov_files":99,"test_count":0},"status":"keep","description":"Added CoworkLLMProviderTests (16 tests for CoworkBackendPresetCatalog preset/presets/defaultPreset, CoworkReasoningHints openAI/anthropic reasoning, CoworkSSEParser payload, CoworkProviderConnectionTester normalizedBaseURL/parseModelIDs, CoworkPromptEgressPolicy statusText). CoworkLLMProvider: 51.3%→51.8%. Overall stable at 28.8% (34,484 exec lines).","timestamp":1778681440824,"segment":0,"confidence":2.499999999999998,"asi":{"hypothesis":{"type":"Phase 1 - CoworkLLMProvider static methods","detail":"Pure reasoning hints, SSE parsing, preset catalog"},"learned":{"cowork_llm_coverage":"51.8% (449/867)","namespace_pattern":"Static methods live in enums: CoworkBackendPresetCatalog, CoworkReasoningHints, CoworkSSEParser, CoworkProviderConnectionTester"}}}
{"run":45,"commit":"ffecd7d","metric":28.8,"metrics":{"total_lines":119699,"exec_lines":34505,"files_covered":199,"zero_cov_files":99,"test_count":0},"status":"keep","description":"Added CoworkWorkspaceModelsTests (21 tests for CoworkToolSummary displayName/category, CoworkSchedulerTask scheduleDescription/title/iso8601Date). Changed 3 private static methods to internal in CoworkWorkspaceModels. CoworkWorkspaceModels: 58.9%→65.3%. Overall stable at 28.8% (34,505 exec lines).","timestamp":1778682377621,"segment":0,"confidence":2.4999999999999867,"asi":{"hypothesis":{"type":"Phase 1 - CoworkWorkspaceModels tests","detail":"displayName, category, scheduleDescription are pure string formatting"},"learned":{"cowork_workspace_models_coverage":"65.3% (213/326) — improved from 58.9%"}}}
