{"run":137,"commit":"cb3f15b","metric":36.4,"metrics":{"exec_lines":32854,"files_covered":193,"test_count":0,"total_lines":90283,"zero_cov_files":76},"status":"keep","description":"Added SearchInfraStaticTests.swift (10 tests) for two 0%-covered Search files. CircuitBreaker (actor state machine: allow-default, opens-after-threshold, success-resets, halfOpen-after-cooldown, engine-independence, healthReport+reset — tested behaviourally via Bool returns since CircuitState is nested-private). SearchHTTPClient (pure statics: userAgent custom/random, GET headers, POST body+content-type). Fixed XCTAssert(await) autoclosure issue by extracting awaits to locals. coverage_pct 36.3%→36.4% (+0.1pt); exec_lines 32779→32854 (+75); files_covered 191→193; zero_cov_files 78→76.","timestamp":1781723965353,"segment":0,"confidence":42.99999999999938,"asi":{"actual_gain":"coverage_pct 36.3%->36.4% (+0.1pt). exec_lines 32779->32854 (+75). files_covered 191->193 (CircuitBreaker.swift + SearchHTTPClient.swift). zero_cov_files 78->76.","hypothesis":"Two 0%-covered Search files (CircuitBreaker 70L actor state machine + SearchHTTPClient 32L pure statics) are tractable in one test file. CircuitBreaker testable behaviourally via Bool returns; HTTPClient via URLRequest assertions.","key_fix":"XCTestAssert*(await ...) fails — autoclosures don't support concurrency. Extract: let r = await cb.method(); XCTAssertTrue(r). Applied to all 6 CircuitBreaker tests.","next":"76 zero-cov remain. Batch strategy (2 files/iter) gives steady +0.1pt +2 files. Next pairs: (ReversibilityEngine 122L + ToolAnalytics 180L), (VectorStore 203L + HandoffKVStore 62L), (BraveEngine 89L + StartpageEngine 89L — URL building). Keep mining small-to-mid non-view zero-cov files.","tests_added":"SearchInfraStaticTests.swift: 10 tests. CircuitBreaker (allow-default, opens-after-threshold, success-resets, halfOpen-after-cooldown, engine-independence, healthReport+reset). SearchHTTPClient (userAgent custom/random, GET headers, POST body+content-type).","visibility_changes":"None — all tested methods already non-private."}}
{"run":138,"commit":"0be2997","metric":36.5,"metrics":{"exec_lines":32968,"files_covered":195,"test_count":0,"total_lines":90283,"zero_cov_files":74},"status":"keep","description":"Added SearchEngineParserTests.swift (9 tests) for two 0%-covered engine parsers. BraveEngine.parseBraveResults (extracts-1/respects-max/skips-standalone/skips-relative-href/empty) + StartpageEngine.parseStartpageResults (extracts-1/respects-max/skips-missing-title/empty), with crafted minimal HTML fixtures matching each engine's block pattern. Pure parsers — no network. coverage_pct 36.4%→36.5% (+0.1pt); exec_lines 32854→32968 (+114); files_covered 193→195; zero_cov_files 76→74.","timestamp":1781724592978,"segment":0,"confidence":43.49999999999938,"asi":{"actual_gain":"coverage_pct 36.4%->36.5% (+0.1pt). exec_lines 32854->32968 (+114). files_covered 193->195 (BraveEngine.swift + StartpageEngine.swift). zero_cov_files 76->74.","hypothesis":"BraveEngine.parseBraveResults + StartpageEngine.parseStartpageResults are PURE HTML parsers (no network) — ideal for fixture-based testing. Testing them + their helpers (extractByClass/extractFirstHref) covers two 0%-covered files at once.","next":"74 zero-cov remain. Continue batching 2 files/iter. Remaining tractable pairs: (ReversibilityEngine 122L filesystem-checkpoint + ToolAnalytics 180L actor), (VectorStore 203L + AudioToneGenerator 70L), or small singletons. Engines done. The 0.1pt+2files/iter cadence is reliable.","tests_added":"SearchEngineParserTests.swift: 9 tests. BraveEngine.parseBraveResults (extracts-1/respects-max/skips-standalone/skips-relative-href/empty). StartpageEngine.parseStartpageResults (extracts-1/respects-max/skips-missing-title/empty). Crafted minimal HTML fixtures matching each engine's block pattern.","visibility_changes":"None — parse funcs were already non-private."}}
{"run":139,"commit":"9ca1285","metric":36.6,"metrics":{"exec_lines":33086,"files_covered":197,"test_count":0,"total_lines":90283,"zero_cov_files":72},"status":"keep","description":"Added AudioAndBackupStaticTests.swift (9 tests) for two 0%-covered files. AudioToneGenerator (pure [Float] signal gen: thinking/listening/readyBeep non-empty + sample-count, amplitude-bounded). MemoryBackup (SQLite VACUUM-INTO backup: creates-valid-readable-backup + creates-dir-if-missing via temp SQLite + GRDB read; rotateBackups: deletes-oldest-beyond-keep/under-keep-noop/missing-dir via fake timestamped files). Fixed GRDB Int.fetchOne(db, sql:) signature. coverage_pct 36.5%→36.6% (+0.1pt); exec_lines 32968→33086 (+118); files_covered 195→197; zero_cov_files 74→72.","timestamp":1781725236630,"segment":0,"confidence":43.99999999999938,"asi":{"actual_gain":"coverage_pct 36.5%->36.6% (+0.1pt). exec_lines 32968->33086 (+118). files_covered 195->197 (AudioToneGenerator.swift + MemoryBackup.swift). zero_cov_files 74->72.","hypothesis":"AudioToneGenerator (pure signal generation, returns [Float] samples) + MemoryBackup (SQLite VACUUM-INTO backup + rotation, both take explicit paths) are a clean batch of 2 zero-cov files.","key_fix":"GRDB Int.fetchOne needs db arg: Int.fetchOne(db, sql:) not Int.fetchOne(sql:).","next":"72 zero-cov remain. Cadence holding at +0.1pt+2files/iter. Next batches: (ReversibilityEngine + MCPToolProxy.schemaToString), (VectorStore + DockIconAnimator), (ToolAnalytics + ProcessCommandSender), (DependencyInstaller + MLXVLMEngine). Also updated autoresearch.ideas.md with Phase 2 methodology + strategy notes.","tests_added":"AudioAndBackupStaticTests.swift: 9 tests. AudioToneGenerator (thinking/listening/readyBeep non-empty + sample-count, amplitude-bounded). MemoryBackup.backup (creates-valid-readable-backup, creates-dir-if-missing via temp SQLite + GRDB read). MemoryBackup.rotateBackups (deletes-oldest-beyond-keep/under-keep-noop/missing-dir-zero via fake timestamped files).","visibility_changes":"None — all tested funcs were already non-private static."}}
{"run":140,"commit":"4811f33","metric":36.8,"metrics":{"exec_lines":33268,"files_covered":199,"test_count":0,"total_lines":90283,"zero_cov_files":70},"status":"keep","description":"Added ToolAnalyticsAndMCPStaticTests.swift (9 tests) for two 0%-covered files. ToolAnalytics (actor+SQLite via temp DB path: record+totalRecords, per-tool summary aggregation, separate-tools, empty). MCPToolProxy.schemaToString (exposed private->internal static; pure MCP.Value->JSON for string/int/bool/object/array). Added `import MCP`. coverage_pct 36.6%→36.8% (+0.2pt); exec_lines 33086→33268 (+182); files_covered 197→199; zero_cov_files 72→70.","timestamp":1781725919751,"segment":0,"confidence":44.999999999999346,"asi":{"actual_gain":"coverage_pct 36.6%->36.8% (+0.2pt). exec_lines 33086->33268 (+182). files_covered 197->199 (ToolAnalytics.swift + MCPToolProxy.swift). zero_cov_files 72->70.","hypothesis":"ToolAnalytics (actor + SQLite, tested via temp DB path: record/summary/totalRecords) + MCPToolProxy.schemaToString (exposed private static, pure MCP.Value->JSON encoder) batch. ToolAnalytics has substantial record/summary/totalRecords bodies so should yield a larger exec-line gain than typical.","key_fix":"Test needs `import MCP` for MCP.Value construction. schemaToString exposed private->internal static.","next":"70 zero-cov remain. Continue 2-files/iter. Per advisor: avoid ReversibilityEngine (pollutes FaeDirectories.recoveryDirectory). Next candidates: (VectorStore 203L actor + DockIconAnimator 137L), (DependencyInstaller 170L + ProcessCommandSender 147L), (MLXVLMEngine 242L + SearchOrchestrator 239L). Pick pairs that avoid AppKit/iCloud/system-permission unless nil/fake-input safe.","tests_added":"ToolAnalyticsAndMCPStaticTests.swift: 9 tests. ToolAnalytics (record+totalRecords, per-tool summary aggregation, separate-tools, empty-no-records — via temp DB path). MCPToolProxy.schemaToString (string/int/bool/object/array MCP.Value->JSON).","visibility_changes":"MCPToolProxy.schemaToString (private static -> internal static)."}}
{"run":141,"commit":"51c4d7e","metric":37,"metrics":{"exec_lines":33436,"files_covered":200,"test_count":0,"total_lines":90283,"zero_cov_files":69},"status":"keep","description":"Added VectorStoreStaticTests.swift (7 tests) for the 0%-covered VectorStore.swift (203L). Registered sqlite-vec on an in-memory GRDB DatabaseQueue (mirroring SQLiteMemoryStore.init) to test the full actor cycle: ensureSchema (zero-dim no-op), upsert+search records (finds-nearest/replaces-existing/rejects-wrong-dim/empty), upsert+search facts. Added `import CSQLiteVecCore`; all calls awaited (actor). MILESTONE: coverage_pct 36.8%→37.0% (+0.2pt) — crossed 37%; exec_lines 33268→33436 (+168); files_covered 199→200 (200 files milestone); zero_cov_files 70→69.","timestamp":1781726917465,"segment":0,"confidence":45.999999999999346,"asi":{"actual_gain":"coverage_pct 36.8%->37.0% (+0.2pt). exec_lines 33268->33436 (+168). files_covered 199->200 (MILESTONE: 200 files). zero_cov_files 70->69.","hypothesis":"VectorStore.swift (203L, 0%) wraps sqlite-vec virtual tables; registering the extension on an in-memory GRDB DatabaseQueue (mirroring SQLiteMemoryStore.init) lets the full ensureSchema->upsert->search cycle run in tests. 8 actor methods.","key_fix":"Need `import CSQLiteVecCore` for sqlite_vec_register + register in prepareDatabase. All VectorStore actor methods need await (test funcs async throws).","milestone":"200 files covered; coverage_pct crossed 37%. From the corrected 35.8% baseline (#128) this is +1.2pt + 16 files in 12 iterations of zero-cov mining.","next":"69 zero-cov remain. Continue. Next tractable pairs (avoid AppKit/iCloud/fs-polluting per advisor): (Memory/EntityBackfillRunner 67L + EmbeddingBackfillRunner 85L if actor-constructible), (SearchOrchestrator 239L), (MLXVLMEngine 242L), (DependencyInstaller 170L — may touch process). Keep the 2-files/iter cadence.","tests_added":"VectorStoreStaticTests.swift: 7 tests. ensureSchema(zero-dim no-op), upsert+search records (finds-nearest/replaces-existing/rejects-wrong-dim/empty), upsert+search facts (finds/wrong-dim-empty). Uses in-memory GRDB + sqlite_vec_register.","visibility_changes":"None — all VectorStore methods were already non-private."}}
{"run":142,"commit":"942f350","metric":37.1,"metrics":{"exec_lines":33499,"files_covered":201,"test_count":0,"total_lines":90283,"zero_cov_files":68},"status":"keep","description":"Added SearchOrchestratorStaticTests.swift (6 tests) for the 0%-covered SearchOrchestrator.swift (239L). Exposed selectEngines + scoreResults (private->internal). selectEngines (all-by-default, fallback-to-all-when-tripped via GlobalCircuitBreaker manipulation). scoreResults (position-decay, weight-varies-by-engine, empty). clearCache smoke. Fixed XCTAssertNotEqual (no Double accuracy overload -> manual abs check). coverage_pct 37.0%→37.1% (+0.1pt); exec_lines 33436→33499 (+63); files_covered 200→201; zero_cov_files 69→68.","timestamp":1781727591884,"segment":0,"confidence":46.499999999999346,"asi":{"actual_gain":"coverage_pct 37.0%->37.1% (+0.1pt). exec_lines 33436->33499 (+63). files_covered 200->201 (SearchOrchestrator.swift). zero_cov_files 69->68.","hypothesis":"SearchOrchestrator.swift (239L, 0%) has pure scoring/selection instance methods. Exposed selectEngines + scoreResults (default SearchOrchestrator() init, no construction friction). Network methods (search/fetchPageContent) excluded.","key_fix":"XCTAssertNotEqual has no accuracy overload for Double -> manual abs(g-d) < 1e-6 check. selectEngines uses process-global GlobalCircuitBreaker.shared so tests reset() before+after.","next":"68 zero-cov remain. Continue. Excluded (Task.detached fire-and-forget, untestable synchronously): EntityBackfillRunner, EmbeddingBackfillRunner. Remaining tractable: (MLXVLMEngine 242L), (DependencyInstaller 170L — process spawn, risky), (ProcessCommandSender 147L), (MLXSpeechVerifier 159L), (VoiceLibrary 122L), (PipelineInstrumentation 105L). Keep cadence.","tests_added":"SearchOrchestratorStaticTests.swift: 6 tests. selectEngines (all-by-default, fallback-to-all-when-tripped via GlobalCircuitBreaker manipulation). scoreResults (position-decay, weight-varies-by-engine, empty). clearCache smoke.","visibility_changes":"SearchOrchestrator: selectEngines, scoreResults (2 private func -> internal func)."}}
{"run":143,"commit":"dbe5ab8","metric":37.2,"metrics":{"exec_lines":33598,"files_covered":203,"test_count":0,"total_lines":90283,"zero_cov_files":66},"status":"keep","description":"Added InstrumentationAndVoiceStaticTests.swift (9 tests) for two 0%-covered files. PipelineInstrumentation (105L actor: start/end no-store no-op, explicit durations accepted, end-without-start guarded no-op, configure+store wiring — default init, all mark methods take optional explicit durations so no crash without store). VoiceLibrary.sanitizeName (exposed private func -> static func; 4 instance callers updated to Self.sanitizeName; pure name normalizer: lowercase+alphanumeric, symbol->dash, hyphen/underscore preserved, empty/all-symbols->unnamed). coverage_pct 37.1%→37.2% (+0.1pt); exec_lines 33499→33598 (+99); files_covered 201→203; zero_cov_files 68→66.","timestamp":1781728266300,"segment":0,"confidence":46.999999999999346,"asi":{"actual_gain":"coverage_pct 37.1%->37.2% (+0.1pt). exec_lines 33499->33598 (+99). files_covered 201->203 (PipelineInstrumentation.swift + VoiceLibrary.swift). zero_cov_files 68->66.","hypothesis":"PipelineInstrumentation (105L actor, pure: every mark method takes optional explicit duration, recordMetric no-ops when store nil) + VoiceLibrary.sanitizeName (exposed private->static, pure name normalizer) batch. PipelineInstrumentation default init, no external deps.","key_fix":"PipelineInstrumentation is an actor -> all mark calls need await. sanitizeName made static so 4 instance callers updated to Self.sanitizeName. configure(store:) needs await (QualityMetricStore is an actor).","next":"66 zero-cov remain. Continue 2-files/iter. Remaining tractable: (MLXVLMEngine 242L actor — load/describe need MLX models, maybe warmup only), (MLXSpeechVerifier 159L actor — load/verify need audio+models), (ProcessCommandSender 147L — process spawn, risky), (DependencyInstaller 170L — approval dialogs, skip), (CommandRouter/HostCommand enums if pure), (FaeDirectories if pure path builders). Keep cadence.","tests_added":"InstrumentationAndVoiceStaticTests.swift: 9 tests. PipelineInstrumentation (start/end no-store noop, explicit durations, end-without-start guarded noop, configure+store wiring). VoiceLibrary.sanitizeName (lowercase+alphanumeric, symbol->dash, hyphen/underscore preserved, empty->unnamed, all-symbols->unnamed).","visibility_changes":"VoiceLibrary.sanitizeName (private func -> static func; 4 callers updated to Self.sanitizeName)."}}
{"run":144,"commit":"redunda","metric":37.2,"metrics":{"exec_lines":33599,"files_covered":203,"test_count":0,"total_lines":90283,"zero_cov_files":66},"status":"discard","description":"DISCARD — PurePolicyAndParsersStaticTests.swift (20 tests) targeted 4 files assumed 0%-covered, but 2 had pre-existing tests (HeardLineParserTests, WAVEncoderTests from Jun 11) and the other 2 were also already covered. Redundant coverage: coverage_pct 37.2% unchanged, exec_lines 33598→33599 (+1 noise), files_covered 203 unchanged, zero_cov_files 66 unchanged. Lesson: must verify true 0%-coverage from llvm-cov JSON before targeting, not guess from file size heuristics.","timestamp":1781729030928,"segment":0,"confidence":46.999999999999346,"asi":{"actual_gain":"ZERO. coverage_pct 37.2%->37.2% (unchanged). exec_lines 33598->33599 (+1, noise). files_covered 203->203 (unchanged). zero_cov_files 66->66 (unchanged).","hypothesis":"Batch 4 pure-logic enum namespaces (ProactivePolicyEngine, HeardLineParser, WAVEncoder, SentimentClassifier) assumed 0%-covered. Targeted via a static-file-size heuristic.","key_learning":"These 4 files were NOT 0%-covered. 2 had pre-existing tests (HeardLineParserTests.swift, WAVEncoderTests.swift from Jun 11) that already covered them at ~97-100%. ProactivePolicyEngine + SentimentClassifier were also already covered. My file-selection heuristic (grep for size/no-UI/no-actor) did NOT check actual coverage status. The llvm-cov JSON export confirmed all 4 at 100% AFTER my tests, but they were already counted in the prior 203 files_covered / 66 zero_cov. REDUNDANT coverage = no metric change.","next":"MUST verify candidate files are truly 0%-covered BEFORE writing tests. Method: parse /tmp/fae_coverage.json, list files with lines.covered==0 && lines.count>0, target ONLY those. Do not trust size/heuristic heuristics. The 66 remaining zero-cov files need to be enumerated from the JSON, not guessed. Revert this; next iteration enumerates actual zero-cov files from coverage JSON.","rollback_reason":"No metric improvement — targeted files were already covered by pre-existing tests. Tests are redundant.","tests_added":"PurePolicyAndParsersStaticTests.swift: 20 tests (7 ProactivePolicyEngine, 6 HeardLineParser, 3 WAVEncoder, 4 SentimentClassifier). All compile + pass, but cover already-covered code."}}
{"run":145,"commit":"09bdad3","metric":37.2,"metrics":{"exec_lines":33622,"files_covered":205,"test_count":0,"total_lines":90283,"zero_cov_files":64},"status":"keep","description":"Added ContextAndCatalogStaticTests.swift (9 tests) for two CONFIRMED 0%-covered files (verified via llvm-cov JSON, lesson from #144 discard). ToolExecutorContext (21L pure value struct: restrictedFallback safe-defaults, full-field construction, ToolExecutorCallbacks.noop no-crash + custom callbacks fire via actor Box). LocalModelCatalog (20L static catalog: voice/vision options non-empty+contain-auto, value uniqueness, isModelCached bool). Fixed XCTAssertEqual(await) autoclosure concurrency (extract to local) + Float? accuracy (manual unwrap). exec_lines 33599→33622 (+23); files_covered 203→205; zero_cov_files 66→64. coverage_pct 37.2% unchanged (gain below 0.1% display rounding).","timestamp":1781729694370,"segment":0,"confidence":46.999999999999346,"asi":{"actual_gain":"exec_lines 33599->33622 (+23). files_covered 203->205 (ToolExecutorContext.swift + LocalModelCatalog.swift). zero_cov_files 66->64. coverage_pct 37.2% unchanged (gain below 0.1% display rounding).","hypothesis":"ToolExecutorContext (21L pure value struct + restrictedFallback factory + ToolExecutorCallbacks.noop) + LocalModelCatalog (20L static catalog arrays + isModelCached). Both confirmed TRUE 0%-covered via llvm-cov JSON check (lesson from prior discard).","key_fix":"XCTAssertEqual(await actor.method()) fails — autoclosure concurrency. Extract to local: let x = await ...; XCTAssertEqual(x, n). Float? has no Double accuracy overload — manual unwrap check.","key_learning":"CRITICAL: after the #144 discard (redundant coverage), now enumerate ACTUAL 0%-covered Fae files from /tmp/fae_coverage.json (filter lines.covered==0 && under Sources/Fae/). 66 true zero-cov Fae files exist; vast majority are SwiftUI views/controllers (Settings*Tab, *View, *Controller, FaeApp). Tractable pure-logic subset: ToolExecutorContext, LocalModelCatalog (done); remaining: CharacterVoiceLibrary(66L), HandoffKVStore(62L, injectable NSUbiquitousKeyValueStore), ToolExecutorContext(done), DebugFileLogger(33L, /tmp).","next":"64 zero-cov Fae files remain. Tractable pure-logic remaining: HandoffKVStore(62L, save/load/clear take injectable NSUbiquitousKeyValueStore — mockable), CharacterVoiceLibrary(66L), DebugFileLogger(33L). Rest are SwiftUI views/controllers needing XCUITest. Strategy validation: each confirmed-0%-cov pure file = +2 files/+~20-40 exec lines reliably.","tests_added":"ContextAndCatalogStaticTests.swift: 9 tests. ToolExecutorContext (restrictedFallback defaults, full construction). ToolExecutorCallbacks (noop no-crash, custom callbacks fire via actor Box). LocalModelCatalog (voice/vision options non-empty+contain-auto, value uniqueness, isModelCached bool).","visibility_changes":"None — all tested members were already non-private."}}
