{"run":46,"commit":"2ecccaa","metric":28.8,"metrics":{"total_lines":119699,"exec_lines":34516,"files_covered":199,"zero_cov_files":99,"test_count":0},"status":"keep","description":"Added SkillManagerStaticTests (9 tests for isSafeSkillName, tierPriority, audioContextForSkill, discoveryRoots, installedSkillNames, parseSkillMarkdown). Changed 2 private static methods to internal in SkillManager. SkillManager: 80.1%→80.8%. Overall stable at 28.8% (34,516 exec lines).","timestamp":1778683282165,"segment":0,"confidence":2.4999999999999867,"asi":{"hypothesis":{"type":"Phase 1 - SkillManager static methods","detail":"isSafeSkillName, tierPriority, parseSkillMarkdown are pure"},"learned":{"skillmanager_coverage":"80.8% (1272/1575)","skill_tier_cases":"builtin, personal, community"}}}
{"run":47,"commit":"02d8cac","metric":28.8,"metrics":{"total_lines":119699,"exec_lines":34520,"files_covered":199,"zero_cov_files":99,"test_count":0},"status":"keep","description":"Extended TextProcessingTests with 6 more tests for monthName and editDistance. Changed 2 private static methods to internal in TextProcessing. Coverage stable at 28.8% (34,520 exec lines). These paths were already covered by existing test flows through batchedTTSSegments.","timestamp":1778684206828,"segment":0,"confidence":2.4999999999999867,"asi":{"hypothesis":{"type":"Phase 1 - TextProcessing monthName/editDistance","detail":"Pure string functions exposed for testing"},"learned":{"textprocessing_coverage":"82.2% (953/1160) — these paths already covered by existing tests"}}}
{"run":48,"commit":"2556b97","metric":28.9,"metrics":{"total_lines":119699,"exec_lines":34534,"files_covered":199,"zero_cov_files":99,"test_count":0},"status":"keep","description":"Added ChannelSettingsStoreTests (9 tests for normalizeChannelKey, normalizeFieldID, parseList, parsePort). Changed 4 private static methods to internal in ChannelSettingsStore. Coverage 28.8%→28.9%. New best!","timestamp":1778684875586,"segment":0,"confidence":2.74999999999998,"asi":{"hypothesis":{"type":"Phase 1 - ChannelSettingsStore static methods","detail":"Pure string parsing functions for channel settings"},"learned":{"channel_settings_coverage":"improved from previous baseline"}}}
{"run":49,"commit":"521f6f3","metric":28.9,"metrics":{"total_lines":119699,"exec_lines":34546,"files_covered":200,"zero_cov_files":98,"test_count":0},"status":"keep","description":"Added EntityContextFormatterTests (6 tests for formatRelationType, formatMultiple). Changed formatRelationType from private→internal. Coverage stable at 28.9% but files_covered: 199→200, zero_cov_files: 99→98. EntityContextFormatter now has coverage.","timestamp":1778685858930,"segment":0,"confidence":2.74999999999998,"asi":{"hypothesis":{"type":"Phase 1 - EntityContextFormatter tests","detail":"formatRelationType is pure string formatting"},"learned":{"files_covered_improvement":"199→200, zero_cov_files: 99→98"}}}
{"run":50,"commit":"df1483c","metric":28.9,"metrics":{"total_lines":119699,"exec_lines":34544,"files_covered":200,"zero_cov_files":98,"test_count":0},"status":"keep","description":"Extended SkillManagerStaticTests with 6 tests for validateSkillName, validateScriptFileName, validateScriptContent. Changed 3 private static methods to internal in SkillManager. Coverage stable at 28.9% (34,544 exec lines). Validation paths already covered by existing test flows.","timestamp":1778686511275,"segment":0,"confidence":2.74999999999998,"asi":{"hypothesis":{"type":"Phase 1 - SkillManager validation methods","detail":"validateSkillName, validateScriptFileName, validateScriptContent"},"learned":{"skillmanager_coverage":"80.8% (1273/1575) — validation paths already covered"}}}
{"run":51,"commit":"e878a06","metric":28.9,"metrics":{"total_lines":119699,"exec_lines":34557,"files_covered":200,"zero_cov_files":98,"test_count":0},"status":"keep","description":"Extended CoworkLLMProviderTests with 4 tests for errorMessage (string/object/none/invalid-json). Changed errorMessage from private→internal in OpenAICompatibleCoworkProvider and AnthropicCoworkProvider. CoworkLLMProvider: 51.8%→52.9%. Overall stable at 28.9% (34,557 exec lines).","timestamp":1778687306384,"segment":0,"confidence":2.74999999999998,"asi":{"hypothesis":{"type":"Phase 1 - CoworkLLMProvider errorMessage","detail":"Pure JSON error extraction from API responses"},"learned":{"cowork_llm_coverage":"52.9% (459/867)"}}}
{"run":52,"commit":"db9bd67","metric":28.9,"metrics":{"total_lines":119699,"exec_lines":34557,"files_covered":200,"zero_cov_files":98,"test_count":0},"status":"keep","description":"Added CorrectionDetectorTests (5 tests for capitalizeFirst, isPlausibleName). Changed 2 private static methods to internal in CorrectionDetector. CorrectionDetector: 97.3% (219/225) — nearly perfect coverage. Overall stable at 28.9% (34,557 exec lines). Small file impact on large denominator.","timestamp":1778687945851,"segment":0,"confidence":2.444444444444434,"asi":{"hypothesis":{"type":"Phase 1 - CorrectionDetector tests","detail":"capitalizeFirst and isPlausibleName are pure string ops"},"learned":{"correctiondetector_coverage":"97.3% (219/225) — nearly perfect"}}}
{"run":53,"commit":"448cf8c","metric":28.9,"metrics":{"total_lines":119699,"exec_lines":34577,"files_covered":200,"zero_cov_files":98,"test_count":0},"status":"keep","description":"Added EchoSuppressorStaticTests (5 tests for extractNumbersFromText, numbersFuzzyMatch, normalizeForOverlap) and ImplicitFeedbackDetectorTests (3 tests for wordBigrams). Changed 4 private static methods to internal. EchoSuppressor: 93.0% (650/699). Overall stable at 28.9% (34,577 exec lines).","timestamp":1778689153249,"segment":0,"confidence":2.1999999999999957,"asi":{"hypothesis":{"type":"Phase 1 - EchoSuppressor + ImplicitFeedbackDetector tests","detail":"Pure string processing functions exposed for testing"},"learned":{"echosuppressor_coverage":"93.0% (650/699)","implicitfeedbackdetector_coverage":"improved from previous baseline"}}}
{"run":54,"commit":"86509d6","metric":28.9,"metrics":{"total_lines":119699,"exec_lines":34602,"files_covered":200,"zero_cov_files":98,"test_count":0},"status":"keep","description":"Added PipelineCoordinatorStaticTests (4 tests for normalizeForPhraseMatch, detectExplicitUserAuthorization). Changed 2 private static methods to internal in PipelineCoordinator. PipelineCoordinator: 2.4%→2.7%. Overall stable at 28.9% (34,602 exec lines). Massive file (8216 lines) with mostly async state machine code.","timestamp":1778689818098,"segment":0,"confidence":2.444444444444424,"asi":{"hypothesis":{"type":"Phase 1 - PipelineCoordinator static methods","detail":"normalizeForPhraseMatch and detectExplicitUserAuthorization are pure"},"learned":{"pipelinecoordinator_coverage":"2.7% (219/8216) — massive file, mostly async state machine"}}}
{"run":55,"commit":"68cd8ef","metric":28.9,"metrics":{"total_lines":119699,"exec_lines":34611,"files_covered":200,"zero_cov_files":98,"test_count":0},"status":"keep","description":"Added MetaOptHypothesisGeneratorTests (7 tests for isToolRelated, isSerializationRelated, directiveAlreadyContains). Changed 3 private static methods to internal in MetaOptHypothesisGenerator. MetaOptHypothesisGenerator: 78.3% (155/198). Overall stable at 28.9% (34,611 exec lines).","timestamp":1778690742170,"segment":0,"confidence":2.1999999999999957,"asi":{"hypothesis":{"type":"Phase 1 - MetaOptHypothesisGenerator tests","detail":"isToolRelated, isSerializationRelated, directiveAlreadyContains are pure"},"learned":{"metaopt_hypothesis_coverage":"78.3% (155/198)"}}}
{"run":56,"commit":"4ab213e","metric":28.9,"metrics":{"total_lines":119699,"exec_lines":34627,"files_covered":200,"zero_cov_files":98,"test_count":0},"status":"keep","description":"Added MetaOptMemorySeedGeneratorTests (6 tests for isToolRelated, isScheduleRelated, isSerializationRelated). Changed 3 private static methods to internal in MetaOptMemorySeedGenerator. MetaOptMemorySeedGenerator: 86.6% (103/119). Overall stable at 28.9% (34,627 exec lines).","timestamp":1778691768901,"segment":0,"confidence":2.2000000000000113,"asi":{"hypothesis":{"type":"Phase 1 - MetaOptMemorySeedGenerator tests","detail":"isToolRelated, isScheduleRelated, isSerializationRelated are pure"},"learned":{"metaopt_memory_seed_coverage":"86.6% (103/119)"}}}
{"run":57,"commit":"4e86fe5","metric":28.9,"metrics":{"total_lines":119699,"exec_lines":34645,"files_covered":201,"zero_cov_files":97,"test_count":0},"status":"keep","description":"Added SkillMigratorTests (2 tests for normalizeSkillMarkdown). Changed normalizeSkillMarkdown from private→internal in SkillMigrator. Coverage stable at 28.9% but files_covered: 200→201, zero_cov_files: 98→97. exec_lines: 34,627→34,645.","timestamp":1778692507561,"segment":0,"confidence":2.1999999999999957,"asi":{"hypothesis":{"type":"Phase 1 - SkillMigrator tests","detail":"normalizeSkillMarkdown is pure string processing"},"learned":{"files_covered_improvement":"200→201, zero_cov_files: 98→97"}}}
{"run":58,"commit":"bf61b5b","metric":28.9,"metrics":{"total_lines":119699,"exec_lines":34645,"files_covered":201,"zero_cov_files":97,"test_count":0},"status":"keep","description":"Added DirectiveTunerTests (4 tests for normaliseGroupKey, groupByContent). Changed groupByContent from private→internal in DirectiveTuner. DirectiveTuner: 96.7% (117/121) — nearly perfect coverage. Overall stable at 28.9% (34,645 exec lines).","timestamp":1778693303784,"segment":0,"confidence":2.4444444444444438,"asi":{"hypothesis":{"type":"Phase 1 - DirectiveTuner tests","detail":"normaliseGroupKey and groupByContent are pure"},"learned":{"directivetuner_coverage":"96.7% (117/121) — nearly perfect"}}}
{"run":59,"commit":"f3cf373","metric":28.9,"metrics":{"total_lines":119699,"exec_lines":34647,"files_covered":201,"zero_cov_files":97,"test_count":0},"status":"keep","description":"Added MemoryDigestServiceTests (10 tests for compactSnippet, digestMetadataJSON, digestSourceRecordIDs, digestSourceKey). Changed 4 private static methods to internal in MemoryDigestService. MemoryDigestService: 90.9% (189/208). Overall stable at 28.9% (34,647 exec lines).","timestamp":1778694474682,"segment":0,"confidence":2.7500000000000044,"asi":{"hypothesis":{"type":"Phase 1 - MemoryDigestService tests","detail":"compactSnippet, digestMetadataJSON, digestSourceRecordIDs, digestSourceKey are pure"},"learned":{"memorydigestservice_coverage":"90.9% (189/208)"}}}
{"run":60,"commit":"a1670f8","metric":29,"metrics":{"total_lines":119699,"exec_lines":34662,"files_covered":201,"zero_cov_files":97,"test_count":0},"status":"keep","description":"NEW BEST 29.0%! Extended WorkWithFaeWorkspaceTests with 8 tests for kindForFile (folder/text/image/document/unknown) and duplicatedWorkspaceName (simple/conflict/multiple-conflicts). Changed 2 private static methods to internal in WorkWithFaeFileEntry and WorkWithFaeWorkspaceStore. WorkWithFaeWorkspace: 75.9% (946/1246). Overall 28.9%→29.0%.","timestamp":1778695789142,"segment":0,"confidence":3.000000000000009,"asi":{"hypothesis":{"type":"Phase 1 - WorkWithFaeWorkspace tests","detail":"kindForFile and duplicatedWorkspaceName are pure functions in large file"},"learned":{"workwithfaeworkspace_coverage":"75.9% (946/1246) — large file, significant impact"}}}
{"run":61,"commit":"94b0773","metric":29,"metrics":{"total_lines":119699,"exec_lines":34665,"files_covered":201,"zero_cov_files":97,"test_count":0},"status":"keep","description":"Extended WorkWithFaeWorkspaceTests with 13 more tests: compressConversation (within-limit/over-limit/hard-cap/summary), reindexed, formattedConversationHistory (normal/empty/summary), attachmentHandle (title/fallback/both-empty), deduplicatedTransforms. Changed 5 private static methods to internal. WorkWithFaeWorkspace: 75.9%→76.2% (949/1246). Overall stable at 29.0% (34,665 exec lines).","timestamp":1778696679763,"segment":0,"confidence":3.000000000000009,"asi":{"hypothesis":{"type":"Phase 1 - WorkWithFaeWorkspace more static methods","detail":"compressConversation, reindexed, formattedConversationHistory, attachmentHandle, deduplicatedTransforms"},"learned":{"workwithfaeworkspace_coverage":"76.2% (949/1246)"}}}
{"run":62,"commit":"51767b8","metric":29,"metrics":{"total_lines":119699,"exec_lines":34665,"files_covered":201,"zero_cov_files":97,"test_count":0},"status":"keep","description":"Extended WorkWithFaeWorkspaceTests with 5 more tests: sanitizedConversationState (truncates-long/short), appendUnique (add/duplicate). Changed 2 private static methods to internal. Coverage stable at 29.0% (34,665 exec lines) — these paths were already covered by existing test flows.","timestamp":1778697535848,"segment":0,"confidence":3.42857142857143,"asi":{"hypothesis":{"type":"Phase 1 - WorkWithFaeWorkspace more static methods","detail":"sanitizedConversationState and appendUnique"},"learned":{"workwithfaeworkspace_coverage":"76.2% (949/1246) — paths already covered"}}}
{"run":63,"commit":"4fccf46","metric":29,"metrics":{"total_lines":119699,"exec_lines":34665,"files_covered":201,"zero_cov_files":97,"test_count":0},"status":"keep","description":"Added CoworkWorkspaceControllerTests (3 tests for workspaceConversationMessage, chatMessage). Changed 2 private static methods to internal. Coverage stable at 29.0% (34,665 exec lines) — conversion functions too small to move needle on this large file (2748 lines).","timestamp":1778698290295,"segment":0,"confidence":3.000000000000009,"asi":{"hypothesis":{"type":"Phase 1 - CoworkWorkspaceController conversion methods","detail":"workspaceConversationMessage and chatMessage are pure conversions"},"learned":{"cowork_workspace_controller_coverage":"35.3% (970/2748) — @MainActor, most code is async state machine"}}}
{"run":64,"commit":"994beb4","metric":29,"metrics":{"total_lines":119699,"exec_lines":34681,"files_covered":201,"zero_cov_files":97,"test_count":0},"status":"keep","description":"Added VisionToolsStaticTests (6 tests for normalize and didVerifyTypedText). Changed 2 private static methods to internal in TypeTextTool. Made ComputerUseSafety enum internal. VisionTools: 10.4%→12.0%. Overall stable at 29.0% (34,681 exec lines).","timestamp":1778699488747,"segment":0,"confidence":3.000000000000009,"asi":{"hypothesis":{"type":"Phase 1 - VisionTools TypeTextTool static methods","detail":"normalize and didVerifyTypedText are pure string processing"},"learned":{"visiontools_coverage":"12.0% (124/1034)"}}}
{"run":65,"commit":"2e93974","metric":29,"metrics":{"total_lines":119699,"exec_lines":34696,"files_covered":201,"zero_cov_files":97,"test_count":0},"status":"keep","description":"Extended CoworkWorkspaceModelsTests with 3 tests for defaultScheduleDescription (memory-reflect/memory-gc/unknown). Changed defaultScheduleDescription from private→internal in CoworkSchedulerTask. CoworkWorkspaceModels: 65.3%→70.9% (231/326). Overall stable at 29.0% (34,696 exec lines).","timestamp":1778700191985,"segment":0,"confidence":3.000000000000009,"asi":{"hypothesis":{"type":"Phase 1 - CoworkWorkspaceModels defaultScheduleDescription","detail":"Pure switch statement mapping task IDs to schedule descriptions"},"learned":{"cowork_workspace_models_coverage":"70.9% (231/326)"}}}
{"run":66,"commit":"8864846","metric":29,"metrics":{"total_lines":119699,"exec_lines":34772,"files_covered":201,"zero_cov_files":97,"test_count":0},"status":"keep","description":"Extended BuiltinToolsTests with 12 tests: validateInstructions (valid/too-long/jailbreak), domainCategory (news/ref/unknown/invalid), displayDomain (with-www/without-www/invalid). Changed 3 private static methods to internal in SelfConfigTool and WebSearchTool. BuiltinTools: 38.4%→46.9% (402/857). Overall stable at 29.0% (34,772 exec lines).","timestamp":1778703522344,"segment":0,"confidence":3.000000000000009,"asi":{"hypothesis":{"type":"Phase 1 - BuiltinTools static methods","detail":"validateInstructions, domainCategory, displayDomain are pure"},"learned":{"builtin_tools_coverage":"46.9% (402/857) — significant improvement"}}}
{"run":67,"commit":"c11b162","metric":29.1,"metrics":{"total_lines":119699,"exec_lines":34786,"files_covered":201,"zero_cov_files":97,"test_count":0},"status":"keep","description":"NEW BEST 29.1%! Extended BuiltinToolsTests with 6 tests: isSafeKeychainKey (valid/too-short/invalid-chars), parseFormValues (typed/nil/empty). Changed 2 private static methods to internal in InputRequestTool and InputRequestBridge. BuiltinTools: 46.9%→48.5% (416/857). Overall 29.0%→29.1%.","timestamp":1778704794981,"segment":0,"confidence":3.2500000000000133,"asi":{"hypothesis":{"type":"Phase 1 - BuiltinTools more static methods","detail":"isSafeKeychainKey and parseFormValues are pure"},"learned":{"builtin_tools_coverage":"48.5% (416/857)"}}}
{"run":68,"commit":"3eadfa8","metric":29.1,"metrics":{"total_lines":119699,"exec_lines":34787,"files_covered":201,"zero_cov_files":97,"test_count":0},"status":"keep","description":"Added TextProcessingStaticTests (7 tests for normalizeForSpeechOutput, replaceRegexMatches, isAliasCandidate). Changed 3 private static methods to internal in TextProcessing. Coverage stable at 29.1% (34,787 exec lines) — these paths were already covered by existing test flows through batchedTTSSegments and other tests.","timestamp":1778706695692,"segment":0,"confidence":3.2500000000000133,"asi":{"hypothesis":{"type":"Phase 1 - TextProcessing more static methods","detail":"normalizeForSpeechOutput, replaceRegexMatches, isAliasCandidate"},"learned":{"textprocessing_coverage":"82.2% (954/1160) — paths already covered"}}}
{"run":69,"commit":"ce86673","metric":29,"metrics":{"total_lines":119699,"exec_lines":34772,"files_covered":201,"zero_cov_files":97,"test_count":0},"status":"keep","description":"Changed 3 private static methods to internal in ToolCallParsing (parseJSONToolCall, parseXMLToolCall, parseGemmaToolCall). ToolCallParsing: 96.2% (254/264) — nearly perfect coverage from existing tests. Overall 29.0% — within measurement noise of 29.1%.","timestamp":1778708011545,"segment":0,"confidence":3.2500000000000133,"asi":{"hypothesis":{"type":"Phase 1 - ToolCallParsing visibility changes","detail":"parseJSONToolCall, parseXMLToolCall, parseGemmaToolCall already covered by existing tests"},"learned":{"toolcallparsing_coverage":"96.2% (254/264) — nearly perfect"}}}
{"run":70,"commit":"6008eb3","metric":29.1,"metrics":{"total_lines":119699,"exec_lines":34816,"files_covered":201,"zero_cov_files":97,"test_count":0},"status":"keep","description":"Added PersonQueryDetectorTests (3 tests for extractNameAndLabel: my-friend/colleague/no-match). Changed extractNameAndLabel from private→internal in PersonQueryDetector. PersonQueryDetector: 79.6% (113/142). Overall back to 29.1% (34,816 exec lines).","timestamp":1778708917792,"segment":0,"confidence":3.2500000000000133,"asi":{"hypothesis":{"type":"Phase 1 - PersonQueryDetector tests","detail":"extractNameAndLabel is pure string processing"},"learned":{"personquerydetector_coverage":"79.6% (113/142)"}}}
{"run":71,"commit":"7c34694","metric":29.1,"metrics":{"total_lines":119699,"exec_lines":34817,"files_covered":201,"zero_cov_files":97,"test_count":0},"status":"keep","description":"Added DamageControlPolicyTests (7 tests for isDestructiveShellCommand and matches). Changed 2 private static methods to internal in DamageControlPolicy. DamageControlPolicy: 94.2% (229/243). Overall stable at 29.1% (34,817 exec lines).","timestamp":1778710641587,"segment":0,"confidence":3.2500000000000133,"asi":{"hypothesis":{"type":"Phase 1 - DamageControlPolicy tests","detail":"isDestructiveShellCommand and matches are pure regex/string ops"},"learned":{"damagecontrolpolicy_coverage":"94.2% (229/243)"}}}
{"run":72,"commit":"082ab98","metric":29.2,"metrics":{"total_lines":119699,"exec_lines":34922,"files_covered":201,"zero_cov_files":97,"test_count":0},"status":"keep","description":"NEW BEST 29.2%! Added NetworkTargetPolicyTests (8 tests for isBlockedIPAddress: loopback/private10/private192/IPv6-loopback/link-local/public-hostname/zero). Changed isBlockedIPAddress from private→internal in NetworkTargetPolicy. NetworkTargetPolicy: 92.9% (65/70). Overall 29.1%→29.2%.","timestamp":1778712305029,"segment":0,"confidence":3.9999999999999796,"asi":{"hypothesis":{"type":"Phase 1 - NetworkTargetPolicy tests","detail":"isBlockedIPAddress is pure IP validation logic"},"learned":{"networktargetpolicy_coverage":"92.9% (65/70)"}}}
{"run":73,"commit":"ace82bb","metric":29.1,"metrics":{"total_lines":119699,"exec_lines":34829,"files_covered":201,"zero_cov_files":97,"test_count":0},"status":"keep","description":"Added ToolStaticTests (11 tests for shellEscape, hashArguments, redactLongOpaqueTokens, escapeHTML, clampInteger). Changed 5 private static methods to internal across SafeSkillExecutor, SecurityEventLogger, SensitiveDataRedactor, TillDoneManager, SessionSearchTool. SafeSkillExecutor: 78.1%, SecurityEventLogger: 71.4%, SensitiveDataRedactor: 100%, SessionSearchTool: 92.9%. Overall 29.1% (34,829 exec lines) — within noise of 29.2%.","timestamp":1778714445453,"segment":0,"confidence":4.666666666666651,"asi":{"hypothesis":{"type":"Phase 1 - Various tool static methods","detail":"shellEscape, hashArguments, redactLongOpaqueTokens, escapeHTML, clampInteger"},"learned":{"sensitive_data_redactor":"100% (38/38)","session_search_tool":"92.9% (78/84)"}}}
