{"run":127,"commit":"7e93b15","metric":35.8,"metrics":{"exec_lines":32280,"files_covered":184,"test_count":0,"total_lines":90283,"zero_cov_files":85},"status":"keep","description":"Real coverage measurement (first to complete the full suite sweep). Added BuiltinToolsStaticTests.swift (29 tests for domainCategory/displayDomain/isCloudMetadataBlocked/approvalDescription/validateInstructions/isSafeKeychainKey/parseFormValues). FIXED autoresearch.sh: skip_suite now strips module prefix (was failing to match IntegrationTests.VocabularyHarvestTests -> ran the hanging suite); added FAE_COV_RESUME resume support + suite-list cache. VocabularyHarvestTests excluded (verified hang under --enable-code-coverage). Measured coverage_pct=35.8% with total_lines=90283 — total_lines doubled vs prior 29.4% baseline because this is the first measurement to complete the full sweep (prior runs were killed mid-sweep).","timestamp":1781716893197,"segment":0,"confidence":26.666666666666593,"asi":{"actual_tests_added":"BuiltinToolsStaticTests.swift: 29 tests covering WebSearchTool.domainCategory (news/reference/code/forum/academic/social/unknown), displayDomain, FetchURLTool.isCloudMetadataBlocked (AWS/GCP/safe/invalid), BashTool.approvalDescription, SelfConfigTool.validateInstructions (ok/too-long/jailbreak), InputRequestTool.isSafeKeychainKey (valid/short/unsafe-chars/empty), InputRequestBridge.parseFormValues (typed/trim-drop/anyMap/missing/empty/nil).","build_chain":"swift build OK; new suite discovered (29 tests listed); measurement completed via autoresearch.sh","hypothesis":"BuiltinTools.swift's pure-logic statics (domainCategory, displayDomain, isCloudMetadataBlocked, approvalDescription, validateInstructions, isSafeKeychainKey, parseFormValues) were uncovered (file at ~38%). Adding 29 focused static-only tests should lift that file's coverage and the repo metric.","measurement_bug_fixed":"autoresearch.sh had TWO bugs preventing completion: (1) skip_suite compared full name 'IntegrationTests.VocabularyHarvestTests' against short 'VocabularyHarvestTests' -> never matched -> ran the HANGING suite under --enable-code-coverage; (2) no resume -> every run re-ran discovery(50s)+250 suites and got killed before the tail. Fixed: skip_suite strips module prefix; FAE_COV_RESUME=1 + DONE_FILE tracks completed suites; SUITE_CACHE skips re-discovery. VocabularyHarvestTests genuinely hangs under coverage instrumentation (verified: timeout 124 exit) and is excluded.","methodology_warning":"total_lines jumped 40K->90K vs the prior 29.4% baseline. The Python line-counter is unchanged, so the difference is that this is the FIRST measurement to actually complete the full suite sweep (prior runs were killed mid-sweep, measuring only ~250/257 suites and a partial profraw merge). The 35.8% is likely the true number; the prior 29.4% was measured against an incomplete profraw set. These two numbers are NOT directly comparable. Treat 35.8% as the new baseline truth going forward.","next":"Re-run the SAME completed measurement once more to confirm 35.8% is stable/reproducible (not a merge artifact). Then target the 85 zero-cov files and the largest-uncovered files (PipelineCoordinator 8216 lines, FaeScheduler, BuiltinTools execute() paths) for the next iteration."}}
{"run":128,"commit":"deaad61","metric":35.8,"metrics":{"exec_lines":32280,"files_covered":184,"zero_cov_files":85,"test_count":0,"total_lines":90283},"status":"keep","description":"Fresh full-sweep verification run (no resume, no cache, clean accum dir). Completed in 8m3s. coverage_pct=35.8% reproduced EXACTLY (total_lines=90283, exec_lines=32280, files_covered=184, zero_cov_files=85). Confirms 35.8% is the stable reproducible baseline, not a merge artifact. The prior 29.4% was measured against incomplete profraw sets (sweeps killed mid-run, ~40K line undercount).","timestamp":1781717400969,"segment":0,"confidence":26.666666666666593,"asi":{"confirmed":"35.8% is the stable, reproducible baseline. total_lines=90283 is the TRUE line count (prior ~40K baseline was an undercount from incomplete profraw sweeps killed mid-run). The +6.4pt jump from the prior-reported 29.4% is mostly methodology correction, not new-test gain — my 29 new BuiltinToolsStaticTests contributed marginally.","hypothesis":"A fresh full sweep (no resume, no cache) should reproduce the resume-measured 35.8% to rule out a stale-merge artifact.","measurement_now_reliable":"Clean run completes in 8m3s with resume+skip+cache fixes. Reproducible to the line. 256 suites (1 excluded hang).","next":"Run per-file uncovered-lines analysis to find the highest-ROI targets: likely PipelineCoordinator (8216 lines, ~3% covered = ~8000 uncovered), FaeScheduler, BuiltinTools execute() async paths, and the 85 zero-cov files."}}
{"run":129,"commit":"fe480ec","metric":35.8,"metrics":{"exec_lines":32357,"files_covered":184,"test_count":0,"total_lines":90283,"zero_cov_files":85},"status":"keep","description":"Added FaeCoreBuilderStaticTests.swift (9 tests for FaeCore's pure static helpers: settingsSection/setting/option/settingsCard/decimal dict builders + loadWAVSamples PCM16 parser with synthesized WAV header). Changed 6 private static funcs to internal in FaeCore.swift. exec_lines 32280→32357 (+77 real lines); coverage_pct displays unchanged at 35.8% (gain below 0.1% rounding on 90K total). Marginal real gain.","timestamp":1781718024040,"segment":0,"confidence":26.666666666666593,"asi":{"actual_gain":"exec_lines 32280->32357 (+77 lines). Below 0.1% rounding so coverage_pct displays as unchanged 35.8%. Real but marginal gain.","hypothesis":"FaeCore.swift (41% covered, 2484 uncovered) has pure static helpers (settings builders, decimal, WAV PCM parser) that are trivially testable. Exposing + testing them should lift exec_lines.","next":"Go bigger: the dict-builder helpers were small. Target larger pure surface — ACPProtocol.swift, ToolExecutor.swift, or the VoicePipeline parsers — OR batch many small files. Alternatively target PipelineCoordinator's 5573 uncovered via more static extraction.","tests_added":"FaeCoreBuilderStaticTests.swift: 9 tests (settingsSection, setting minimal+full+options, option, settingsCard, decimal, loadWAVSamples PCM16/too-small/missing-file with a synthesized 44-byte WAV header).","visibility_changes":"Changed 6 private static funcs to internal static in FaeCore.swift: settingsSection, setting, option, settingsCard, decimal, loadWAVSamples."}}
{"run":130,"commit":"397ee23","metric":35.9,"metrics":{"exec_lines":32405,"files_covered":184,"test_count":0,"total_lines":90283,"zero_cov_files":85},"status":"keep","description":"Added PureHelpersStaticTests.swift (16 tests). Exposed+tested: DaemonWire.estimateTextTokens/jsonByteCount/valueAfterColon/stripTrailingAnnotation (DaemonLLMEngine.swift); WAVParser.readU16/readU32/readI16 (little-endian byte readers); ToolAugmentationManager.detectProjectType (Rust/Swift/TS/JS/Python/none with temp files) + extractGitRemote (parses .git/config origin URL). coverage_pct 35.8%→35.9% (exec_lines 32357→32405, +48 real lines). Crossed the 0.1% display threshold.","timestamp":1781718773531,"segment":0,"confidence":26.99999999999993,"asi":{"actual_gain":"coverage_pct 35.8%->35.9% (crossed the 0.1% display threshold). exec_lines 32357->32405 (+48 real lines).","hypothesis":"Batching pure static helpers across 3 files (DaemonWire in DaemonLLMEngine.swift, WAVParser, ToolAugmentationManager) gives more surface per iteration than single-file work.","lesson":"errnoString in DaemonLLMEngine.swift lives in a NESTED scope (brace depth 2 inside DaemonWire) not directly on the enum — calling DaemonWire.errnoString() fails. Skipped it (4 lines, low value). When a 'no member' error appears despite a matching decl, check brace depth / nested-type ownership before chasing.","next":"Continue batching pure helpers: MetaOptNarrator describeChange family (6 funcs, pure string formatting), MemoryInboxService text helpers (5), SpeakerProfileStore defaultDisplayName/defaultRole/isCentroidDegenerate (5). Or target a single larger pure file. Each batch of ~5 funcs reliably yields +40-60 exec lines (+0.1%).","tests_added":"PureHelpersStaticTests.swift: 16 tests. DaemonWire: estimateTextTokens, jsonByteCount (valid/invalid), valueAfterColon, stripTrailingAnnotation. WAVParser: readU16/readU32/readI16 little-endian. ToolAugmentationManager: detectProjectType (Rust/Swift/TypeScript/JS/Python/none), extractGitRemote (origin URL / nil).","visibility_changes":"DaemonWire: estimateTextTokens, jsonByteCount, valueAfterColon, stripTrailingAnnotation, errnoString (5 private->internal in DaemonLLMEngine.swift). WAVParser: readU16, readU32, readI16 (3 private->internal). ToolAugmentationManager: detectProjectType, extractGitRemote (2 private->internal)."}}
{"run":131,"commit":"057aeed","metric":35.9,"metrics":{"exec_lines":32434,"files_covered":184,"test_count":0,"total_lines":90283,"zero_cov_files":85},"status":"keep","description":"Added InboxAndRegistryStaticTests.swift (9 tests). Exposed+tested: MemoryInboxService.importedRecordText (string builder: with title+origin, without, truncation) + readPlainText (utf8/empty/missing file); DaemonProcessRegistry register/unregister/terminateAll (pid tracking, unknown-pid no-op, empty terminate). exec_lines 32405→32434 (+29 real lines); coverage_pct displays unchanged at 35.9% (below 0.1% rounding).","timestamp":1781719741897,"segment":0,"confidence":26.99999999999993,"asi":{"actual_gain":"exec_lines 32405->32434 (+29 real lines). coverage_pct displays unchanged at 35.9% (gain below 0.1% rounding).","hypothesis":"MemoryInboxService.importedRecordText (string builder) + readPlainText (file reader) + DaemonProcessRegistry register/unregister/terminateAll (pid tracking) are pure/testable and uncovered.","next":"Need bigger surface per iteration to keep crossing 0.1%. Options: (a) target ONE large file with many pure funcs in a single test file (e.g. extract 10+ helpers from PipelineCoordinator), (b) batch 4-5 files' helpers per iteration. Also consider the 85 zero-cov files for any that are pure logic (not SwiftUI).","tests_added":"InboxAndRegistryStaticTests.swift: 9 tests. MemoryInboxService.importedRecordText (title+origin / nil / truncation), readPlainText (utf8 / empty / missing). DaemonProcessRegistry register/unregister/terminateAll (register+unregister+terminate, unknown-pid no-op, empty terminate).","visibility_changes":"MemoryInboxService: importedRecordText, readPlainText (2 private->internal static)."}}
{"run":132,"commit":"9bf54c5","metric":36.1,"metrics":{"exec_lines":32583,"files_covered":186,"test_count":0,"total_lines":90283,"zero_cov_files":83},"status":"keep","description":"Added EntityLinkerParsingTests.swift (15 tests). Exposed+tested EntityLinker.extractFields (relation/name detection: family/romantic/colleague/friend/none + prefix strip), extractEdges (works_at/employed_by/lives_in/multiple/empty), extractFirstName (simple/stops-at-verb/empty/lowercase). Changed extractFirstName private->internal. Uses in-memory GRDB DatabaseQueue() to construct EntityStore->EntityLinker. coverage_pct 35.9%→36.1% (+0.2pt); exec_lines 32434→32583 (+149); files_covered 184→186 (EntityLinker.swift + EntityStore.swift newly covered); zero_cov_files 85→83.","timestamp":1781720909656,"segment":0,"confidence":27.666666666666604,"asi":{"actual_gain":"coverage_pct 35.9%->36.1% (+0.2pt). exec_lines 32434->32583 (+149). files_covered 184->186 (EntityLinker.swift + EntityStore.swift newly covered). zero_cov_files 85->83.","hypothesis":"Targeting a 0%-covered pure-logic file (EntityLinker.swift, 244 lines) yields far more than nibbling partial files: its parsing core (extractFields/extractEdges/extractFirstName) is pure string logic, and constructing EntityLinker only needs an in-memory GRDB DatabaseQueue.","key_insight":"ZERO-COV PURE-LOGIC FILES are the highest-ROI targets. EntityLinker gave +149 exec lines (+0.2pt + 2 files) in one iteration vs ~30-50 lines from partial-file helper nibbling. Next iterations should mine the remaining zero-cov 'maybe-pure' files: EntityStore (854, partially now covered), ACPSessionManager (595), MetaOptimizer (445), EntityLinker done. Also the GRDB in-memory pattern (DatabaseQueue()) unlocks EntityStore/SQLiteMemoryStore/SessionStore instance-method coverage.","next":"Mine more zero-cov maybe-pure files. Top candidates: ACPSessionManager.swift (595, 0%), MetaOptimizer.swift (445, 0%), WorkspaceSnapshot.swift (295, 0%), DeviceHandoff.swift (299, 0%), DaemonEventSubscriber.swift (279, 0%). Check each for pure/static funcs or in-memory-constructible actors.","tests_added":"EntityLinkerParsingTests.swift: 15 tests. extractFields (relation+name, prefix-strip, romantic/colleague/friend/none), extractEdges (workplace/employed-by/location/multiple/empty), extractFirstName (simple/stops-at-verb/empty/lowercase-nil). Uses in-memory GRDB DatabaseQueue to construct EntityStore -> EntityLinker.","visibility_changes":"EntityLinker: extractFirstName (1 private func -> internal). extractFields/extractEdges were already non-private."}}
{"run":133,"commit":"450ae54","metric":36.2,"metrics":{"exec_lines":32697,"files_covered":187,"test_count":0,"total_lines":90283,"zero_cov_files":82},"status":"keep","description":"Added WorkspaceSnapshotStaticTests.swift (21 tests) for the 0%-covered WorkspaceSnapshot.swift file. Tested pure statics across sibling structs: WorkspaceToolSummary.displayName/category (Apple/Scheduler/Skills/ComputerUse/Core/Voice/General), WorkspaceSchedulerTask.scheduleDescription (interval/daily/weekly/fallback)/defaultScheduleDescription/title/iso8601Date. No visibility changes needed (all non-private statics). coverage_pct 36.1%→36.2% (+0.1pt); exec_lines 32583→32697 (+114); files_covered 186→187; zero_cov_files 83→82.","timestamp":1781721517894,"segment":0,"confidence":27.99999999999994,"asi":{"actual_gain":"coverage_pct 36.1%->36.2% (+0.1pt). exec_lines 32583->32697 (+114). files_covered 186->187 (WorkspaceSnapshot.swift newly covered). zero_cov_files 83->82.","hypothesis":"WorkspaceSnapshot.swift (295 lines, 0%) has many pure static funcs (displayName/category/scheduleDescription/defaultScheduleDescription/title/iso8601Date) spread across its sibling structs (WorkspaceToolSummary, WorkspaceSchedulerTask). Testing them should cover the file's pure core.","key_correction":"The funcs are NOT on WorkspaceSnapshot itself but on sibling structs in the same FILE: WorkspaceToolSummary (displayName, category) and WorkspaceSchedulerTask (scheduleDescription, defaultScheduleDescription, title, iso8601Date). Initial test used wrong type; corrected owners. Lesson: when 'no member' errors appear, check sibling structs in the same file, not just the headline type.","next":"Continue mining zero-cov files. Remaining maybe-pure: ACPSessionManager (595, actor — buildTranscript/isAgentTransportNoise/parseExecOutput are pure-ish but instance methods), MetaOptimizer (445, encodeScores pure), DeviceHandoff (299), DaemonEventSubscriber (279, errnoString nested). Or pivot to large partial files now that the zero-cov pure pool is shrinking.","tests_added":"WorkspaceSnapshotStaticTests.swift: 21 tests. WorkspaceToolSummary.displayName (capitalise/acronyms/single), category (Apple/Scheduler/Skills/ComputerUse/Core/Voice/General). WorkspaceSchedulerTask.scheduleDescription (interval-min/hours, daily-pad, weekly, fallback), defaultScheduleDescription (known/unknown), title (capitalise), iso8601Date (valid/invalid/empty).","visibility_changes":"None — all tested funcs were already non-private static."}}
{"run":134,"commit":"f73d012","metric":36.2,"metrics":{"exec_lines":32712,"files_covered":189,"test_count":0,"total_lines":90283,"zero_cov_files":80},"status":"keep","description":"Added AgentAndMetaOptStaticTests.swift (6 tests). Exposed+tested: ACPSessionManager.isAgentTransportNoise (static noise-marker detection), MetaOptimizer.encodeScores (made static to avoid ImprovementStore DB dep; 3 internal callers updated to Self.encodeScores). files_covered 187→189 (ACPSessionManager.swift + MetaOptimizer.swift newly covered); zero_cov_files 82→80; exec_lines 32697→32712 (+15); coverage_pct 36.2% (line gain below display threshold).","timestamp":1781722122000,"segment":0,"confidence":33.60000000000001,"asi":{"actual_gain":"exec_lines 32697->32712 (+15). files_covered 187->189 (ACPSessionManager.swift + MetaOptimizer.swift newly covered). zero_cov_files 82->80. coverage_pct displays unchanged 36.2% (line gain below 0.1% rounding, but +2 files covered is meaningful).","hypothesis":"ACPSessionManager.isAgentTransportNoise (static) + MetaOptimizer.encodeScores (made static to avoid constructing the actor's ImprovementStore DB dep) are pure and uncover 2 zero-cov files.","key_change":"Made MetaOptimizer.encodeScores static (was private instance func). It doesn't use self, so static is correct + avoids the ImprovementStore construction dependency. Updated 3 internal callers (encodeScores -> Self.encodeScores).","next":"80 zero-cov files remain. Continue mining: DeviceHandoff (299), DaemonEventSubscriber (279), OrbStateBridgeController (389), OnboardingController (383), JitPermissionController (383), FaeLocalRuntimeServer (338). Check each for pure/static funcs. The pattern (expose 1-3 pure funcs -> cover a whole file) reliably yields +1-2 files/iteration.","tests_added":"AgentAndMetaOptStaticTests.swift: 6 tests. ACPSessionManager.isAgentTransportNoise (websocket-fallback/stream-disconnect/root-CA detect + normal/empty reject). MetaOptimizer.encodeScores (sorted JSON with values + all-nil).","visibility_changes":"ACPSessionManager.isAgentTransportNoise (private static -> internal static). MetaOptimizer.encodeScores (private func -> internal static); 3 callers updated to Self.encodeScores."}}
{"run":135,"commit":"4ff2a3f","metric":36.3,"metrics":{"exec_lines":32760,"files_covered":190,"test_count":0,"total_lines":90283,"zero_cov_files":79},"status":"keep","description":"Added DeviceHandoffParsingTests.swift (7 tests) for the 0%-covered DeviceHandoff.swift. Tested DeviceCommandParser.parse (pure static command-string parser: empty/whitespace, go-home, move-to-watch, move-to-iphone, punctuation+case normalisation, unsupported) + DeviceTarget raw values. No visibility changes. coverage_pct 36.2%→36.3% (+0.1pt); exec_lines 32712→32760 (+48); files_covered 189→190; zero_cov_files 80→79.","timestamp":1781722680118,"segment":0,"confidence":42.49999999999938,"asi":{"actual_gain":"coverage_pct 36.2%->36.3% (+0.1pt). exec_lines 32712->32760 (+48). files_covered 189->190 (DeviceHandoff.swift). zero_cov_files 80->79.","hypothesis":"DeviceHandoff.swift (299 lines, 0%) has DeviceCommandParser.parse — a pure static command-string parser (go home / move to watch/iphone). Testing it covers the file's core.","next":"79 zero-cov files remain. Best remaining pure candidates: DaemonEventSubscriber.errnoString (static, but nested-scope risk), FaeLocalRuntimeServer.generateBearerToken (static). AccessibilityBridge has 17 statics but all touch AppKit (NSRunningApplication/NSWorkspace) — risky in CI but isDeniedAutomationTarget with fake pid returns false cleanly. Controllers (OrbStateBridge/Onboarding/JitPermission) are instance-heavy, low pure surface.","tests_added":"DeviceHandoffParsingTests.swift: 7 tests. DeviceCommandParser.parse (empty/whitespace unsupported, go home, move watch, move iphone, punctuation+case normalisation, unrelated unsupported). DeviceTarget rawValues + allCases.","visibility_changes":"None — parse was already non-private static."}}
{"run":136,"commit":"2d8d2d6","metric":36.3,"metrics":{"exec_lines":32779,"files_covered":191,"test_count":0,"total_lines":90283,"zero_cov_files":78},"status":"keep","description":"Added TestServerStaticTests.swift (14 tests) for the 0%-covered TestServer.swift (981L). Tested 3 pure statics: appendNonce (nil/empty value/nonce, truncate-8, short), appendNonceToText (append/nil/empty), digestSourceCount (parse-ids/empty-array/nil/missing-key/invalid-json). Test class @MainActor (TestServer is main-actor-isolated). files_covered 190→191; zero_cov_files 79→78; exec_lines 32760→32779 (+19); coverage_pct 36.3%.","timestamp":1781723304029,"segment":0,"confidence":42.49999999999938,"asi":{"actual_gain":"exec_lines 32760->32779 (+19). files_covered 190->191 (TestServer.swift, 981L). zero_cov_files 79->78. coverage_pct 36.3% (+19 below display threshold).","hypothesis":"TestServer.swift (981L, 0%) has 3 pure statics (appendNonce/appendNonceToText/digestSourceCount). Testing them covers the file (biggest zero-cov file yet targeted).","key_correction":"TestServer is @MainActor-isolated -> test class needs @MainActor too. Small funcs (~15 lines total) so gain is modest despite the large file.","next":"78 zero-cov files. The pure-static pool is nearly exhausted; remaining big zero-cov files are Controllers (instance-heavy, AppKit/EventKit deps) and views. Next high-value: (a) AccessibilityBridge 17 statics (AppKit but several return cleanly with fake inputs), (b) pivot to LARGE partial files via the GRDB in-memory pattern (SessionStore/SQLiteMemoryStore/EntityStore instance methods now reachable). Also consider batching multiple small zero-cov files per iteration.","tests_added":"TestServerStaticTests.swift: 14 tests. TestServer.appendNonce (nil/empty value, nil/empty nonce, truncate-8, short), appendNonceToText (append/nil/empty), digestSourceCount (parse-ids/empty-array/nil/missing-key/invalid-json).","visibility_changes":"None — all 3 were already non-private static."}}
