{"run":146,"commit":"0acb598","metric":37.3,"metrics":{"exec_lines":33638,"files_covered":207,"test_count":0,"total_lines":90283,"zero_cov_files":62},"status":"keep","description":"Added DebugLoggerAndSkillTypesStaticTests.swift (10 tests) for two CONFIRMED 0%-covered files (verified via llvm-cov JSON). DebugFileLogger (33L @MainActor: creates-file-on-init, writes-jsonl-line with seq/kind/text/newline, appends-multiple-lines, sorted-keys-JSON-ordering — writes to fixed /tmp/fae-debug.jsonl, safe for tests). SkillTypes (pure: SkillType/SkillTier rawValue round-trip, SkillMetadata.isChannel true/false/empty-tags, field access). Fixed setUp/tearDown async-throws -> sync (FileManager.removeItem). Replaced Codable round-trip (SkillMetadata is Sendable-only) with field-access test. coverage_pct 37.2%→37.3% (+0.1pt); exec_lines 33622→33638 (+16); files_covered 205→207; zero_cov_files 64→62.","timestamp":1781730404475,"segment":0,"confidence":37.999999999999986,"asi":{"actual_gain":"coverage_pct 37.2%->37.3% (+0.1pt). exec_lines 33622->33638 (+16). files_covered 205->207 (DebugFileLogger.swift + Skills/SkillTypes.swift). zero_cov_files 64->62.","hypothesis":"DebugFileLogger (33L @MainActor class, writes to FIXED /tmp/fae-debug.jsonl — safe for tests, NOT user state) + SkillTypes (pure enums + SkillMetadata.isChannel computed property). Both confirmed 0%-covered via llvm-cov JSON.","key_fix":"setUp/tearDown as 'async throws' caused 'expression is async/throws' errors on FileManager.removeItem — made them synchronous (override func setUp/tearDown without async throws). SkillMetadata is Sendable-only (NOT Codable) so replaced Codable round-trip test with field-access test.","next":"62 zero-cov Fae files remain. Tractable non-UI pure-logic remaining: CharacterVoiceLibrary(66L, actor singleton + ~/Library disk — risky shared state), HandoffKVStore(62L, injectable NSUbiquitousKeyValueStore but .default pollutes iCloud), ReversibilityEngine(122L — private partitioned Array ext + fs methods, advisor warned). The remaining ~55 are SwiftUI views/controllers (Settings*Tab, *View, *Controller, FaeApp) needing XCUITest. Nearing the UI-layer wall.","tests_added":"DebugLoggerAndSkillTypesStaticTests.swift: 10 tests. DebugFileLogger (creates-file-on-init, writes-jsonl-line-with-seq/kind/text, appends-multiple-lines, sorted-keys-JSON-ordering). SkillTypes (SkillType/SkillTier rawValue round-trip, SkillMetadata.isChannel true/false/empty, field access).","visibility_changes":"None."}}
{"run":147,"commit":"74b3bc5","metric":0,"metrics":{"total_lines":0,"exec_lines":0,"files_covered":0,"zero_cov_files":0,"test_count":0},"status":"crash","description":"Crash: attempted ./autoresearch.sh from repo root, but script is not at top level. No benchmark ran.","timestamp":1781772274064,"segment":0,"confidence":37.999999999999986,"asi":{"hypothesis":"Run the coverage sweep after adding ReversibilityEngine filesystem tests and DependencyInstaller static tests.","rollback_reason":"Wrong experiment command path: ./autoresearch.sh not found at project root.","next_action_hint":"Locate the actual coverage/autoresearch script path (likely under native/macos/Fae or scripts), reapply if auto-reverted, and run it with run_experiment."}}
{"run":148,"commit":"566c78c","metric":37.5,"metrics":{"total_lines":90129,"exec_lines":33816,"files_covered":211,"zero_cov_files":58,"test_count":0},"status":"keep","description":"Added ReversibilityEngineFilesystemTests (5 temp-dir tests for createCheckpoint/restore/latestCheckpoint/pruneExpired, using FAE_REVERSIBILITY_RECOVERY_DIR to avoid user state) and DependencyInstallerStaticTests (4 tests for uv metadata, catalog, InstallResult, InstallError). coverage_pct 37.3%→37.5%; exec_lines 33638→33816 (+178); files_covered 207→211; zero_cov_files 62→58.","timestamp":1781772827730,"segment":0,"confidence":32.333333333333634,"asi":{"hypothesis":"ReversibilityEngine's filesystem checkpoint/restore paths and DependencyInstaller's pure dependency metadata were undercovered, and can add meaningful lines without system prompts or user state.","validation":"Targeted Swift test passed before full sweep; full coverage sweep passed with 277 suites, 828 profraw files merged.","coverage_delta":"+0.2 percentage points from prior best 37.3 to 37.5","exec_lines_delta":"+178","files_covered_delta":"+4","zero_cov_files_delta":"-4","safety_note":"Reversibility tests use FAE_REVERSIBILITY_RECOVERY_DIR pointed at a temp directory, avoiding real Fae recovery state."}}
{"run":149,"commit":"e452fec","metric":37.5,"metrics":{"total_lines":90129,"exec_lines":33836,"files_covered":213,"zero_cov_files":56,"test_count":0},"status":"keep","description":"Added MLProtocolAndAudioClassifierStaticTests (9 tests). Exposed CoreMLAudioClassifier.timeNormalizeMel as internal static and tested invalid dims/identity/interpolation/downsample; covered ClassifierConfig decode and ClassificationResult; exercised TTSEngine and VLMEngine protocol extension defaults with fake actors. Rounded coverage_pct stable at 37.5%, but exec_lines 33816→33836 (+20), files_covered 211→213, zero_cov_files 58→56.","timestamp":1781773505895,"segment":0,"confidence":32.333333333333634,"asi":{"hypothesis":"CoreMLAudioClassifier had a pure time-normalization helper inside a 0%-covered system-dependent file, and MLProtocols had default protocol extension methods that can be covered with fake actors.","validation":"Targeted Swift test passed; full coverage sweep passed with 278 suites and 831 profraw files merged.","coverage_delta":"rounded coverage stable at 37.5; unrounded coverage improved via +20 covered lines","exec_lines_delta":"+20","files_covered_delta":"+2","zero_cov_files_delta":"-2","lesson":"Small protocol/helper files may not move rounded percentage but still reduce confirmed zero-coverage count."}}
