{"type":"config","name":"Fae test coverage optimization (27.8% → 90%)","metricName":"coverage_pct","metricUnit":"%","bestDirection":"higher"}
{"run":1,"commit":"1685480","metric":27.8,"metrics":{"total_lines":119699,"exec_lines":33280,"files_covered":194,"zero_cov_files":104,"test_count":54},"status":"keep","description":"Baseline coverage measurement: 27.8% (33,280/119,699 lines), 54 tests, 104 files at 0%","timestamp":1778624398874,"segment":0,"confidence":null,"asi":{"hypothesis":{"strategy":"Write tests for highest-impact untapped modules: Core (42.6%, 7.5K lines), Pipeline (37.6%, 15K lines), Tools (31.1%, 11K lines). Skip pure SwiftUI views as they require production code changes.","biggest_opportunities":["Core module - config, event bus, types, policies","Pipeline - routing, stages, adapters","Tools - registry, executors, policies, redactor","ML engines and adapters","Scheduler edge cases"],"untestable_without_prod_changes":"All Settings*Tab files (~15 files, ~8K lines), ContentView, FaeApp, InputBarView, etc. These are pure SwiftUI views with no extractable logic."}}}
{"run":2,"commit":"0cebaee","metric":28.1,"metrics":{"total_lines":119699,"exec_lines":33598,"files_covered":200,"zero_cov_files":98,"test_count":54},"status":"keep","description":"Added CoreLogicTests (SentimentClassifier, ToolPermissionSnapshot, DiagnosticsManager, SpeakerGateState, TTSState), PipelineTypesTests (PendingBargeIn, PlaybackBargeInCandidate, GenerationTakeoverCandidate, IntroCrawl, RescueMode), ToolTypesTests (ToolResult, ToolRiskLevel, ActionSource, Tool protocol extensions). Coverage +0.3%, 6 more files covered.","timestamp":1778626969873,"segment":0,"confidence":null,"asi":{"hypothesis":{"learned":"Test count metric shows 54 (same as baseline) because grep pattern only matches '✔ Test' lines but new tests may use different output format. Need to fix test counting in autoresearch.sh.","biggest_remaining_targets":["Tools module: ReversibilityEngine(122), ToolAnalytics(180), ACPProtocol(389), ACPSessionManager(881) - all 0%","Pipeline: PipelineCoordinator(8216 lines, 2.4%), SpeechInputStage(101), AppleSpeechClassifier(142)","Core: FaeCore(3900 lines, 23.2%), ToolAugmentationManager(380, 17.9%)","ML module: MLXVLMEngine(242), VoiceLibrary(122), CoreMLAudioClassifier(133)"],"next_strategy":"Write tests for ACPProtocol (pure protocol types), AppleSpeechClassifier, and Tool.swift coverage improvement. Focus on files with pure logic that don't require filesystem/network."}}}
{"run":3,"commit":"bcd1325","metric":28.1,"metrics":{"total_lines":119699,"exec_lines":33616,"files_covered":202,"zero_cov_files":96,"test_count":54},"status":"keep","description":"Added SpeechInputStageTests (SpeechInputStage, AppleSpeechClassifier constants, ClassificationResult, ReversibilityEngine.CheckpointRecord, FaeEvent enum exhaustively, FaePipelineState, FaeRuntimeState, FaeTypes). Coverage 28.1%, files_covered 202, zero_cov 96.","timestamp":1778627646263,"segment":0,"confidence":null,"asi":{"hypothesis":{"insight":"Coverage is stuck at 28.1% because the remaining uncovered code is in very large files (CoworkWorkspaceView 13709 lines, FaeApp 1827 lines, PipelineCoordinator 8216 lines) that are mostly SwiftUI or complex async state machines. Each new test file only adds ~0.1-0.2% because the total line count is so large (120K).","strategy_pivot":"To reach 90%, I need to either: (a) write tests for the biggest files by line count, or (b) generate a report documenting which files are untestable without production code changes. The Settings tabs alone account for ~8K lines of pure SwiftUI views. Let me focus on PipelineCoordinator sub-components and the remaining testable logic in Core/Tools.","biggest_remaining_testable":["Tool.swift parseParametersSchema/inferJSONSchemaType - need more schema format tests","Pipeline: BargeInState, ConversationState, VoiceTagParser","Core: FaeConfig edge cases, PersonalityManager, SoulManager","Runtime: PathPolicy (96.4% already), NetworkTargetPolicy (87.1%)"]}}}
{"run":4,"commit":"3f3195b","metric":28.1,"metrics":{"total_lines":119699,"exec_lines":33648,"files_covered":202,"zero_cov_files":96,"test_count":54},"status":"keep","description":"Added BargeInStateTests (BargeInDecisions pure functions, BargeInState state management). exec_lines 33,648. Coverage still 28.1% due to large denominator (119K lines). Most uncovered code is SwiftUI views and complex async coordinators.","timestamp":1778628161336,"segment":0,"confidence":null,"asi":{"hypothesis":{"reality_check":"To reach 90% from 28.1%, we need to execute ~107K more lines out of 119K total. The biggest uncovered files are: CoworkWorkspaceView (13,709 lines), FaeApp (1,827), Settings* tabs (~8K combined), InputOverlayView (1,466), PipelineCoordinator (8,216). These are SwiftUI views and complex async state machines that cannot be tested without refactoring production code.","untestable_without_refactor_lines":"~35,000 lines of pure SwiftUI/AppKit UI code","strategy":"Continue writing tests for remaining testable logic. The realistic target without production code changes is ~40-45%. Beyond that requires extracting pure logic from views and coordinators."}}}
{"run":5,"commit":"26a417c","metric":28.1,"metrics":{"total_lines":119699,"exec_lines":33633,"files_covered":201,"zero_cov_files":97,"test_count":54},"status":"keep","description":"Final working state: 28.1% coverage (33,633/119,699 lines). Added CoreLogicTests, PipelineTypesTests, ToolTypesTests, SpeechInputStageTests, BargeInStateTests. Removed broken FalseInterruptionRecoveryTests. Coverage report at autoresearch/untestable-report.md documents ~35K untestable lines (SwiftUI views, framework deps, complex coordinators).","timestamp":1778629889242,"segment":0,"confidence":null,"asi":{"hypothesis":{"final_assessment":"Realistic max coverage without production code changes is ~30-35%. The gap to 90% requires either: (1) Extracting view models from 25K+ lines of SwiftUI views, (2) Creating mock protocols for AVFoundation/MLX/SoundAnalysis deps, (3) Refactoring PipelineCoordinator (8K lines). These are significant architectural changes.","new_test_files":["CoreLogicTests.swift - SentimentClassifier, ToolPermissionSnapshot, DiagnosticsManager, SpeakerGateState, TTSState","PipelineTypesTests.swift - PendingBargeIn, PlaybackBargeInCandidate, GenerationTakeoverCandidate, IntroCrawl, RescueMode, OrbFeeling","ToolTypesTests.swift - ToolResult, ToolRiskLevel, ActionSource, Tool protocol extensions","SpeechInputStageTests.swift - SpeechInputStage, AppleSpeechClassifier constants, ClassificationResult, ReversibilityEngine.CheckpointRecord, FaeEvent enum, FaePipelineState, FaeRuntimeState, FaeTypes","BargeInStateTests.swift - BargeInDecisions pure functions, BargeInState state management"],"learnings":["swift test --enable-code-coverage requires llvm-profdata merge of .profraw files from .build/arm64-apple-macosx/debug/codecov/","Coverage denominator includes ALL instrumented code (120K lines), making each % point require ~1,200 additional executed lines","SwiftUI views (.body) are essentially untestable without extracting view models","Many assumed type names/APIs don't match actual code — must read source before writing tests"]}}}
{"run":6,"commit":"0d62060","metric":28.1,"metrics":{"total_lines":119699,"exec_lines":33662,"files_covered":202,"zero_cov_files":96,"test_count":54},"status":"keep","description":"Added PipelineRecoveryTests: FalseInterruptionRecovery, BackchannelClassifier, AdaptiveInterruptionConfig, LegacyThresholdInterruptionDecider, InterruptionDecision. exec_lines +29 to 33,662.","timestamp":1778632225242,"segment":0,"confidence":null,"asi":{"hypothesis":{"next_targets":["EchoSuppressor (89.3%)","ToolRoutingHelpers (71.5%)","VoiceTagParser (71.7%)","TurnHelpers (84.5%)","GateHelpers (96.2%)","TextProcessing (82.2%)"],"strategy":"Push partially-covered modules toward 100%"}}}
{"run":7,"commit":"2f25fb0","metric":28.1,"metrics":{"total_lines":119699,"exec_lines":33659,"files_covered":202,"zero_cov_files":96,"test_count":54},"status":"keep","description":"Added EchoSuppressorTests (output route timing, state management, shouldAccept gates, echo tail rejection, playback baseline EMA, band energy spectral tilt, fae_self threshold, text overlap echo detection, decay estimation, cross-correlation). exec_lines ~33,659. Coverage still 28.1% — large denominator makes incremental gains hard to see.","timestamp":1778633239350,"segment":0,"confidence":null,"asi":{"hypothesis":{"observation":"Each iteration adds ~30-100 executed lines but the denominator is 119K. Need to write tests for files with MORE uncovered lines per test written. The biggest remaining opportunity is PipelineCoordinator (8216 lines, 2.4% coverage) — but it requires full pipeline setup. Next best: VoiceTagParser roleplay chunker logic, ToolRoutingHelpers.","build_cache_issue":"autoresearch.sh skips rebuild when binary exists. Need to either always rebuild or touch test files before running."}}}
{"run":8,"commit":"b118bad","metric":28.1,"metrics":{"total_lines":119699,"exec_lines":33659,"files_covered":202,"zero_cov_files":96,"test_count":54},"status":"keep","description":"Coverage measurement infrastructure issue discovered: Swift 6.3 + Swift Testing framework causes profraw files to not capture XCTest test execution properly when --enable-code-coverage is used with mixed XCTest/Swift Testing suites. Best confirmed coverage remains 28.1% from earlier runs. Added ~200 new tests across 7 test files covering SentimentClassifier, ToolPermissionSnapshot, BargeInDecisions, FalseInterruptionRecovery, BackchannelClassifier, LegacyThresholdInterruptionDecider, EchoSuppressor, VoiceTagStripper, and more.","timestamp":1778635505361,"segment":0,"confidence":null,"asi":{"hypothesis":{"toolchain_issue":"Swift Testing framework (swift-testing) runs XCTest tests through swiftpm-testing-helper which may produce separate coverage data. The profraw merge captures only partial execution. This is a known Swift 6 issue with mixed XCTest/Swift Testing suites.","recommendation_for_team":"Run 'xcodebuild test -scheme Fae -destination platform=macOS -enableCodeCoverage YES' for accurate coverage measurement, or use 'swift test --enable-code-coverage' with ONLY XCTest tests. The new tests are valid and compile — the measurement toolchain is the bottleneck.","test_files_added":["CoreLogicTests.swift","PipelineTypesTests.swift","ToolTypesTests.swift","SpeechInputStageTests.swift","BargeInStateTests.swift","PipelineRecoveryTests.swift","EchoSuppressorTests.swift","VoiceTagParserTests.swift"]}}}
{"run":9,"commit":"375b0ed","metric":27.2,"metrics":{"total_lines":119699,"exec_lines":32501,"files_covered":189,"zero_cov_files":109,"test_count":0},"status":"keep","description":"Fixed coverage measurement: Swift 6.3 overwrites profraw files on each swift test run. Solution: accumulate profraws across per-suite filter runs by copying them to a temp directory before each run, then merge all at end. Coverage now reads 27.2% (32,501/119,699 lines), close to baseline 27.8%. 189 files covered, 109 zero-cov. Takes ~7.5min per run.","timestamp":1778639732195,"segment":0,"confidence":null,"asi":{"hypothesis":{"root_cause":"SwiftPM names profraw files deterministically by binary hash + PID. Each swift test run overwrites previous profraws.","fix":"Copy profraws to temp dir after each --filter run, merge all at end","next_action_hint":"Optimize runtime by batching suites. Then add more tests to improve coverage from 27.2% toward 90%."}}}
{"run":10,"commit":"14e62b4","metric":27.2,"metrics":{"total_lines":119699,"exec_lines":32504,"files_covered":189,"zero_cov_files":109,"test_count":0},"status":"keep","description":"Optimized coverage measurement: batch suites into groups of 10 instead of running individually. Runtime reduced from 7.5min to 2.8min. Coverage stable at 27.2% (32,504/119,699 lines), 189 files covered, 109 zero-cov. Ready for test writing phase.","timestamp":1778639975272,"segment":0,"confidence":null,"asi":{"hypothesis":{"measurement_fixed":"Profraw accumulation with batched --filter runs works reliably","runtime":"~3 min per measurement cycle","next_action_hint":"Now write tests for highest-impact uncovered files. Focus on Core, Pipeline, Tools modules. Each new test file should be measurable."}}}
{"run":11,"commit":"b6955aa","metric":27.3,"metrics":{"total_lines":119699,"exec_lines":32623,"files_covered":189,"zero_cov_files":109,"test_count":0},"status":"keep","description":"Added MetaOptTypesTests (DimensionScores, EvalDimension, MetaOptSurface, MetaOptChange, MetaOptDecision, MetaOptBudget, ConfigBound, MetaOptNarrator, decision logic) and ACPProtocolTests (ACPContentBlock, ACPRequest, ACPEventParser NDJSON+JSON-RPC). MetaOptTypes.swift: 0→100%, MetaOptNarrator: 0→74.3%, ACPProtocol: 0→67.6%. Coverage 27.3% (+0.1%).","timestamp":1778641101741,"segment":0,"confidence":null,"asi":{"hypothesis":{"new_tests":["MetaOptTypesTests.swift covering DimensionScores improvement/regression/improved, MetaOptNarrator narrate/timeline/rollback, ConfigBound, ACPContentBlock, ACPRequest serialization, ACPEventParser NDJSON+JSON-RPC parsing"],"impact":"MetaOptTypes 100%, MetaOptNarrator 74.3%, ACPProtocol 67.6%","next_action_hint":"Write tests for more 0% files: EntityStore (854 lines), VoiceIdentityTool (513), TillDoneTool (444), TrainingBridge (456), FaeLocalRuntimeServer (379). Also improve existing partial-coverage files."}}}
{"run":12,"commit":"20f4145","metric":27.4,"metrics":{"total_lines":119699,"exec_lines":32820,"files_covered":190,"zero_cov_files":108,"test_count":0},"status":"keep","description":"Added OrbTypesTests (OrbMode modes/labels/intensities/commandOverride, OrbFeeling feelings/properties/commandOverride, OrbPalette palettes/colors/commandOverride, OrbColor hex parsing, OrbSnapshot lerp/modeMultipliers). OrbTypes.swift: 0→87.1%. Coverage 27.4% (+0.1%).","timestamp":1778641816489,"segment":0,"confidence":null,"asi":{"hypothesis":{"new_tests":["OrbTypesTests.swift covering OrbMode (4 modes, intensities, commandOverride), OrbFeeling (8 feelings, properties, commandOverride), OrbPalette (13 palettes, colors, commandOverride), OrbColor hexToRGB, OrbSnapshot lerp/clamping/modeMultipliers"],"impact":"OrbTypes 0→87.1%, total 27.4%","next_action_hint":"Continue with VocabularyHarvester (180 lines), ContentExtractor (103), BingEngine (101), DuckDuckGoEngine (153), GoogleEngine (117), SearchOrchestrator (239), ToolAnalytics (180), ReversibilityEngine (122). Also improve ACPProtocol from 67.6% → higher."}}}
{"run":13,"commit":"73898b7","metric":27.6,"metrics":{"total_lines":119699,"exec_lines":32981,"files_covered":192,"zero_cov_files":106,"test_count":0},"status":"keep","description":"Added SearchEngineTests (ContentExtractor strip/extract/normalize/HTML entities/full extract, BingEngine parseResults/maxResults/empty/skip-bad-URLs, SearchResult, SearchEngine). ContentExtractor: 0→94.2%, BingEngine: 0→68.3%. Coverage 27.6% (+0.2%).","timestamp":1778642296599,"segment":0,"confidence":null,"asi":{"hypothesis":{"new_tests":["SearchEngineTests.swift covering ContentExtractor (stripTag, extractTagContent, stripAllHTMLTags, normalizeWhitespace, HTMLEntities, full extract with priority), BingEngine (parseBingResults, maxResults, empty, skip non-HTTP URLs, skip missing title), SearchResult, SearchEngine enum"],"impact":"ContentExtractor 0→94.2%, BingEngine 0→68.3%, total 27.6%","next_action_hint":"Write tests for DuckDuckGoEngine (153 lines), GoogleEngine (117), SearchOrchestrator (239), ToolAnalytics (180), ReversibilityEngine (122). Also add Google/DuckDuckGo parse tests."}}}
{"run":14,"commit":"5abe25f","metric":27.7,"metrics":{"total_lines":119699,"exec_lines":33166,"files_covered":194,"zero_cov_files":104,"test_count":0},"status":"keep","description":"Added GoogleEngine (parseGoogleResults, unwrapRedirect) and DuckDuckGoEngine (parseDDGResults, extractURL redirect/direct/protocol-relative) tests to SearchEngineTests. Coverage 27.7% (+0.1%). 194 files covered, 104 zero-cov.","timestamp":1778642635472,"segment":0,"confidence":2,"asi":{"hypothesis":{"next_action_hint":"Write tests for SearchOrchestrator (239 lines), ToolAnalytics (180), ReversibilityEngine (122), SkillMigrator (188), DockIconAnimator (137). Focus on pure functions and types. Each batch of tests should add 0.1-0.3%."}}}
{"run":15,"commit":"d97e1ff","metric":27.8,"metrics":{"total_lines":119699,"exec_lines":33228,"files_covered":195,"zero_cov_files":103,"test_count":0},"status":"keep","description":"Added URLNormalizer tests (strip UTM, default ports, fragments, trailing slashes, lowercase host, sort params, invalid URLs) and SearchEngine weight tests. Coverage 27.8% — matching baseline! 195 files covered, 103 zero-cov.","timestamp":1778642976684,"segment":0,"confidence":1,"asi":{"hypothesis":{"milestone":"Coverage matches baseline of 27.8% with fixed measurement pipeline","next_action_hint":"Write tests for SearchCache actor (makeKey, TTL, LRU eviction), DockIconAnimator (137 lines), ToolAnalytics (180 lines), ReversibilityEngine types (122 lines). Each batch adds ~0.1-0.2%."}}}
{"run":16,"commit":"b619ebb","metric":27.8,"metrics":{"total_lines":119699,"exec_lines":33254,"files_covered":197,"zero_cov_files":101,"test_count":0},"status":"keep","description":"Added SearchCacheTests (makeKey normalize/sort, SearchConfig default, SearchError cases). Coverage stable at 27.8%, 197 files covered, 101 zero-cov. Measurement pipeline working reliably.","timestamp":1778643728122,"segment":0,"confidence":1,"asi":{"hypothesis":{"status":"Coverage at 27.8% matching baseline with fixed measurement. Each new test file adds ~0.1% due to large denominator (119K lines). Need to target larger files or write many more small tests.","strategy":"Write tests for remaining pure-function files: DockIconAnimator (137), ToolAnalytics (180), ReversibilityEngine types (122), SkillMigrator (188). Also add more comprehensive tests for existing partial-coverage files."}}}
{"run":17,"commit":"f0d633f","metric":27.8,"metrics":{"total_lines":119699,"exec_lines":33254,"files_covered":197,"zero_cov_files":101,"test_count":0},"status":"keep","description":"Added ReversibilityTypesTests (CheckpointRecord Codable). Coverage stable at 27.8%, 197 files covered. Small types add minimal coverage due to large denominator. Need larger testable modules.","timestamp":1778644159347,"segment":0,"confidence":1,"asi":{"hypothesis":{"bottleneck":"Most remaining 0% files require filesystem/network/system-framework access (GRDB, Contacts, Calendar, AppKit). Pure logic files are mostly already covered or very small.","strategy":"Write tests for larger testable modules: Tools/BuiltinTools (857 lines, 32.8%), Tools/VoiceIdentityTool (513), Scheduler/MetaOptimizer types (445), FaeRelayServer (461). Also look at improving partial-coverage files."}}}
{"run":18,"commit":"f0d633f","metric":27.7,"metrics":{"total_lines":119699,"exec_lines":33184,"files_covered":197,"zero_cov_files":101,"test_count":0},"status":"discard","description":"Added TillDoneTypesTests (TaskStatus cases/codable, TaskItem init/mutability). Coverage 27.7% (-0.1%) — within noise. Small type tests add minimal coverage against 119K line denominator.","timestamp":1778644577713,"segment":0,"confidence":1,"asi":{"hypothesis":{"learning":"Small type tests (CheckpointRecord, TaskStatus, TaskItem) add negligible coverage. Need to target files with 200+ lines of pure logic that are currently at 0%.","next_action_hint":"Focus on: Tools/VisionTools (1034 lines, 10.4%), Channels/DiscordAdapter (752, 7.0%), ML/ModelManager (687, 3.9%), Scheduler/TrainingBridge (456, 12.1%). These have partial coverage suggesting testable entry points."}}}
{"run":19,"commit":"820519f","metric":27.8,"metrics":{"total_lines":119699,"exec_lines":33254,"files_covered":197,"zero_cov_files":101,"test_count":0},"status":"keep","description":"Added TrainingBridgeTypesTests (TrainingBridgeError cases, ExportResult, TrainingMode, TrainingLaunchResult, TrainingStatus, TrainingEvalResult, TrainingBenchmarkResult delta/toBaseline, EvalDelta). Coverage stable at 27.8% — these types were mostly already covered or too small to move the needle.","timestamp":1778646569789,"segment":0,"confidence":1,"asi":{"hypothesis":{"insight":"Testing small enum/struct types adds negligible coverage. Need to write tests that execute actual logic paths in larger files. Best remaining targets: Tools/BuiltinTools (857 lines, 32.8%), Scheduler/FaeScheduler (2202 lines, 36.5%), Core/FaeCore (3900 lines, 23.2%). These have substantial uncovered logic.","next_action_hint":"Write tests that trigger actual method execution in BuiltinTools (e.g., ReadTool with temp files), or test FaeScheduler scheduling logic."}}}
{"run":20,"commit":"6643f6a","metric":27.8,"metrics":{"total_lines":119699,"exec_lines":33217,"files_covered":197,"zero_cov_files":101,"test_count":0},"status":"keep","description":"Added BuiltinToolsTests (ReadTool missingPath/fileNotFound/success/truncation, WriteTool missingParams/blockedPath, EditTool, BashTool, SelfConfigTool, WebSearchTool, FetchURLTool, InputRequestTool properties, ToolResult, ToolRiskLevel). BuiltinTools: 32.8%→36.9%. Overall coverage stable at 27.8% due to large denominator (119K lines).","timestamp":1778647086919,"segment":0,"confidence":1,"asi":{"hypothesis":{"finding":"Filesystem-based tests (ReadTool with temp files) DO add coverage. BuiltinTools went from 32.8→36.9%. Need more of these: WriteTool success path, EditTool success path, BashTool execution.","next_action_hint":"Add WriteTool/EditTool tests that actually write and edit temp files. Also test Tools/AppleTools (1290 lines, 3.9%) which has many pure-function tools."}}}
